id_str,full_text,created_at,favourites_count,statuses_count,followers_count,retweeted,retweet_count,retweeted_text,location,hashtags,user_mentions,symbols,urls
1085593056487698432,sir werent involved misunderstanding always clear…,Wed Jan 16 17:42:08 +0000 2019,12086,7799,279,False,1,sir werent involved misunderstanding always clear tried pull crap petty end indian media idiot our apologies,Mumbai India,0,5,0,0
1085592540697419776,,Wed Jan 16 17:40:05 +0000 2019,2398,72737,505,False,2,sir dont know ask question surely pray please national judicial appointments commission,NAVI MUMBAI ,0,10,0,0
1085592523609788416,american wants leadership usa instead trolling ought learn…,Wed Jan 16 17:40:01 +0000 2019,1283,1160,15,False,4,american wants leadership usa instead trolling ought learn leadership manipulative politicking won’t pay run dynasty,Unknown,0,3,0,0
1085591322696663040,working do…,Wed Jan 16 17:35:15 +0000 2019,27904,30741,1112,False,1,working things given command without using,Bhubaneswar,0,5,0,0
1085591101296295936,judge joining conparty comes our go…,Wed Jan 16 17:34:22 +0000 2019,591,1015,76,False,1,judge joining conparty comes our governor explains demonetization wrong step india growing vested interest,Unknown,0,6,0,0
1085590561254301696,shame italian mafia alva dynasty pidi rascals spreading…,Wed Jan 16 17:32:13 +0000 2019,31686,17012,299,False,34,shame italian mafia alva dynasty pidi rascals spreading lies insulting our hon pm modiji rascals jealous losers twist good thing happening india pm insult pm italian mafia games,Goa India,1,5,0,0
1085589966321795074,suicide india need,Wed Jan 16 17:29:51 +0000 2019,9,75,2,False,17,suicide india need,Unknown,3,5,0,0
1085588126045618176,maintains silence would voters integrity,Wed Jan 16 17:22:33 +0000 2019,9564,135000,17337,False,1,maintains silence would voters integrity writes editor read,Mumbai India,2,3,0,0
1085587415056535554,govt departments political leaders journ…,Wed Jan 16 17:19:43 +0000 2019,666,1727,241,False,1,govt departments political leaders journalists supporting youre last hope please help,Unknown,0,7,0,0
1085587210932502528,sure must heard atleast isn’t giving award…,Wed Jan 16 17:18:54 +0000 2019,5608,16672,157,False,6,sure must heard atleast isn’t giving award former pms know,Visakhapatnam,1,3,0,0
1085587179726876673,difference empathy,Wed Jan 16 17:18:47 +0000 2019,86675,127998,12836,False,1,difference empathy,जय हिन्द 🇮🇳,0,5,0,0
1085586283705978881,congratulating award went award famous jury…,Wed Jan 16 17:15:13 +0000 2019,12641,26031,55,False,8,congratulating award went award famous jury unheard aligarh company,Unknown,0,3,0,0
1085585255531040769,scholar hike fellowship,Wed Jan 16 17:11:08 +0000 2019,3236,3024,37,False,7,scholar hike fellowship,Uttar Pradesh India,3,3,0,0
1085583232702111744,family gave national awards😂 gave fake international award😂,Wed Jan 16 17:03:06 +0000 2019,81996,66922,261,False,88,family gave national awards😂 gave fake international award😂 awarded legitimate work activating rti grassroots empowering poor citizens fight corruption,Unknown,0,3,0,0
1085582544983281665,ji namo request citizens india including pls sup…,Wed Jan 16 17:00:22 +0000 2019,5,64,2,False,1,ji namo request citizens india including pls support namo country nit gath,Unknown,0,5,0,0
1085580867014152194,looser goi,Wed Jan 16 16:53:42 +0000 2019,466,404,14,False,3,looser goi,Chandigarh India,0,9,0,0
1085580143202951173,real hero osm…,Wed Jan 16 16:50:49 +0000 2019,5660,278337,6035,False,1,real hero osm work,khanabadosh,0,9,0,0
1085579281432903680,reduced troll people should…,Wed Jan 16 16:47:24 +0000 2019,293117,318686,2281,False,5,reduced troll people should waste time reading responding tweets,തിരുവനന്തപുരം கேரள भारत,0,5,0,0
1085579247614226432,mera desh raha hai let congress ruled states learn,Wed Jan 16 16:47:16 +0000 2019,1598,33327,229,False,1,mera desh raha hai let congress ruled states learn adopt,Unknown,0,6,0,0
1085578412415012865,,Wed Jan 16 16:43:57 +0000 2019,2072,1965,46,False,6,please declare result,Unknown,0,10,0,0
1085577906326188032,nandlal tweeted,Wed Jan 16 16:41:56 +0000 2019,2072,1965,46,False,8,nandlal tweeted please declare,Unknown,0,8,0,0
1085577771902877696,,Wed Jan 16 16:41:24 +0000 2019,2072,1965,46,False,2,ha plz,Unknown,0,10,0,0
1085577484618223617,time lost our support,Wed Jan 16 16:40:16 +0000 2019,1708,1821,22,False,5,time lost our support,Varanasi India,0,7,0,0
1085576499342782465,feat ga**du daily,Wed Jan 16 16:36:21 +0000 2019,57,403,1,False,1,feat ga**du daily,Unknown,0,4,0,0
1085574278613938178,,Wed Jan 16 16:27:31 +0000 2019,17,97,3,False,33,sir pls increase si vacancies,Unknown,1,9,0,0
1085574224453009409,making fool people media time,Wed Jan 16 16:27:18 +0000 2019,555,1089,46,False,1,making fool people media time,New Delhi India,0,5,0,0
1085574143028969474,indian media clowns master wl malign hunger fr po…,Wed Jan 16 16:26:59 +0000 2019,19700,70896,659,False,4,indian media clowns master wl malign hunger fr power,Thailand,0,5,0,0
1085572501743136769,shame india today researchers went silent protest,Wed Jan 16 16:20:28 +0000 2019,290,794,65,False,1,shame india today researchers went silent protest delhi sent,Hyderabad India,0,4,0,0
1085570610086871042,insane shame goi,Wed Jan 16 16:12:57 +0000 2019,1534,1546,31,False,7,insane shame goi,Chandigarh India,0,8,0,0
1085569864683515904,doordarshan style tv programs congress con…,Wed Jan 16 16:09:59 +0000 2019,54923,400000,10002,False,5,doordarshan style tv programs congress controlled equal level field congress rule would call shameful,Gorakhpur🏵Bastar🏵️ India ,0,5,0,0
1085569787445407744,science jail shame govt,Wed Jan 16 16:09:40 +0000 2019,1,905,5,False,8,science jail shame govt,Chennai India,3,2,0,0
1085569692163440640,something called grace human an…,Wed Jan 16 16:09:18 +0000 2019,4839,2687,44,False,3,something called grace human something called nations honor,Mumbai India,0,6,0,0
1085569673297567744,exactly type naya na hai” spoke di…,Wed Jan 16 16:09:13 +0000 2019,189,202,12,False,84,exactly type naya na hai” spoke disrespects anthem drinking water,KOLKATA,1,3,0,0
1085569027668365313,done mphil heard philip kotler man is…,Wed Jan 16 16:06:39 +0000 2019,4770,4376,34,False,23,done mphil heard philip kotler man educated person degree mock award given kotler doesnt education people around,Unknown,0,4,0,0
1085564380283109376,really itching moment sir ur master ji charlie chapl…,Wed Jan 16 15:48:11 +0000 2019,241,246,45,False,1,really itching moment sir ur master ji charlie chaplin award,Unknown,0,5,0,0
1085563853210112002,,Wed Jan 16 15:46:06 +0000 2019,168,157,14,False,2,wow going negative impact medical students india pool doctors world afford silly scams wife studies medicine russia attention need resolution,Unknown,0,10,0,0
1085560579106983942,,Wed Jan 16 15:33:05 +0000 2019,610,414,39,False,1,may our government taking action properly,Gorakhpur,0,10,0,0
1085558470089203713,thank much sir,Wed Jan 16 15:24:42 +0000 2019,7776,8793,271,False,28,thank much sir,New Delhi India,0,7,0,0
1085557733003354112,,Wed Jan 16 15:21:46 +0000 2019,85,225,5,False,14,please declare ca result candidate waiting final result please please please please please please please please please please please please please please please please please please please please please please please please please please please please please please,Unknown,0,9,0,0
1085556969002299394,,Wed Jan 16 15:18:44 +0000 2019,17505,189043,3623,False,38,congress ka haath always enemies india especially election time mr supported pak stand kashmir,India,0,10,0,0
1085555604427587584,trying pm due marketing gujarat cm terms,Wed Jan 16 15:13:19 +0000 2019,1563,1738,13,False,1,trying pm due marketing gujarat cm terms tried marketing knw tht worked,Unknown,0,4,0,0
1085554667776499712,time impose art,Wed Jan 16 15:09:36 +0000 2019,1047,734,23,False,3,time impose art,Unknown,0,3,0,1
1085553023445696513,opp stadium dogra chowk jammu,Wed Jan 16 15:03:04 +0000 2019,533,447,1175,False,1,opp stadium dogra chowk jammu,Anantnag Jammu And Kashmir,1,4,0,0
1085552510084022279,following item remind recollect pertinent news ht…,Wed Jan 16 15:01:01 +0000 2019,6285,490704,28003,False,1,following item remind recollect pertinent news,Unknown,0,5,0,0
1085550730004447233,,Wed Jan 16 14:53:57 +0000 2019,109171,100200,1248,False,2,modi government flagship scheme achieves target universal electricity access close reality via namo app,Some Where In Aryabrat.,0,9,0,0
1085549672679251971,,Wed Jan 16 14:49:45 +0000 2019,14564,455140,33133,False,1,should retain power things would nosedive’ chairman election modi vs via namo app,🛫 रायबरेली  🛬 अहमदाबाद 🛩️,0,9,0,0
1085549572758265856,science jail india,Wed Jan 16 14:49:21 +0000 2019,1534,1546,31,False,5,science jail india,Chandigarh India,3,2,0,0
1085546972956758016,threat pm might come,Wed Jan 16 14:39:01 +0000 2019,7127,7019,38,False,3,threat pm might come,Bengaluru South India,2,3,0,0
1085546925942661121,pm helped mr aa steal havent yet got answer defence ministry officials,Wed Jan 16 14:38:50 +0000 2019,3674,19197,139,False,16,pm helped mr aa steal havent yet got answer defence ministry officials pm rafale deal congress president,Nuapada India,0,2,0,0
1085546751656906752,people scam,Wed Jan 16 14:38:08 +0000 2019,23033,40695,189,False,17,people scam good done congress dynasty lived royals case modi family lives ordinary life slog nation people experiencing positive changes mud stick,Unknown,0,9,0,0
1085544713250328581,thank good wishes modi ji,Wed Jan 16 14:30:02 +0000 2019,1027,2337,71,False,4731,thank good wishes modi ji,Unknown,0,2,0,0
1085543784962768896,congress trying hard fake scam defame video expose th…,Wed Jan 16 14:26:21 +0000 2019,92452,301285,21220,False,98,congress trying hard fake scam defame video expose cheap tactics watch please show prince’,अमरोहा(जे पी नगर) & मेरठ भारत,0,2,0,0
1085543247039074305,funny isnt little tricycle looks shocked di…,Wed Jan 16 14:24:13 +0000 2019,1425,3174,62,False,1,funny isnt little tricycle looks shocked loose something,Unknown,0,4,0,0
1085542267702706177,great interview none fitting,Wed Jan 16 14:20:19 +0000 2019,3641,3477,39,False,1,great interview none fitting,Unknown,0,3,0,1
1085540929786785793,modi reminded giv…,Wed Jan 16 14:15:00 +0000 2019,40873,85215,1701,False,2,modi reminded giving electricity far flung kashmir pak lit house could easily points forth filmsy samaj ko toda cong ne ne toh joda tustikaran karne se ar tutega jaise sal mein cong ne toda,Indraprastha,0,8,0,0
1085540527523667968,hope qualify,Wed Jan 16 14:13:24 +0000 2019,40873,85215,1701,False,1,hope qualify work,Indraprastha,0,8,0,0
1085538910044934149,pappu aka tricycle,Wed Jan 16 14:06:59 +0000 2019,5358,13304,73,False,1,pappu aka tricycle,somewhere on earth,0,4,0,0
1085537581893181440,minds jail shame,Wed Jan 16 14:01:42 +0000 2019,32,1605,19,False,1,minds jail shame,चेन्नई भारत,0,5,0,0
1085535660411314176,irony ruling party opp…,Wed Jan 16 13:54:04 +0000 2019,462,1511,27,False,10,irony ruling party opposition along frontline media ol concerned self motives nations welfare.they ol nations representative,Chennai India,2,4,0,0
1085532497864212481,,Wed Jan 16 13:41:30 +0000 2019,25500,8700,540,False,1,semen queen stupids indian media thr greatest dont seriously owner mom serious,Unknown,0,11,0,0
1085532182217613312,picture shehzada crying fowl philip kotler award pic nehru indira awarded thems…,Wed Jan 16 13:40:15 +0000 2019,2449,2959,108,False,75,picture shehzada crying fowl philip kotler award pic nehru indira awarded civilian award india ratna hyppocrat,Karnataka India,0,3,0,0
1085530687619379201,dear rajdeep really surprising totally adver…,Wed Jan 16 13:34:18 +0000 2019,1563,1738,13,False,1,dear rajdeep really surprising totally adverse responses nearly receive tweets favour grand corrupt party feign ignorance dont wiser,Unknown,0,5,0,0
1085530030699134976,modi govt real data growth mm joshi led panel,Wed Jan 16 13:31:42 +0000 2019,3106,48670,206,False,1,modi govt real data growth mm joshi led panel,Grey side of the moon,0,4,0,1
1085529507157618688,legislative judicial separation power checks constitution no…,Wed Jan 16 13:29:37 +0000 2019,1028,1011,11,False,1,legislative judicial separation power checks constitution pmo could run entire nation without supreme court election commission,Unknown,0,3,0,0
1085527474530865152,help please,Wed Jan 16 13:21:32 +0000 2019,160,15708,431,False,10,help please,Mumbai India,0,9,0,0
1085527428653494272,research scholars custody demanding rights shame,Wed Jan 16 13:21:21 +0000 2019,1,306,6,False,3,research scholars custody demanding rights shame,Unknown,2,3,0,0
1085526097297575936,fact check jawaharlal nehru award ratna himself…,Wed Jan 16 13:16:04 +0000 2019,765573,887875,49818,False,3,fact check jawaharlal nehru award ratna himself?,Allah ke Zamin per. ,0,5,0,0
1085523721220227073,please hear opinion modi spreading falsehood lies.…,Wed Jan 16 13:06:37 +0000 2019,2777,13512,108,False,1,please hear opinion modi spreading falsehood lies,Unknown,0,3,0,0
1085523537811595265,people talk worries talks issues affecting india terrorism,Wed Jan 16 13:05:54 +0000 2019,27,69109,1374,False,45,people talk worries talks issues affecting india terrorism maoism corruption etc issues worry really simple worry modi keeps talking modi,Unknown,0,2,0,0
1085523346706452481,surely yes thing mr thinks otherwise,Wed Jan 16 13:05:08 +0000 2019,5087,6535,49,False,9,surely yes thing mr thinks otherwise,Bharat,0,5,0,0
1085522512094683136,shamelessly used kid fake fan shame gulams,Wed Jan 16 13:01:49 +0000 2019,8809,6429,71,False,1,shamelessly used kid fake fan shame gulams,Unknown,0,5,0,0
1085517502413598720,,Wed Jan 16 12:41:55 +0000 2019,251,4819,55,False,23,sir pls vacancies si,Lucknow India,1,10,0,0
1085515835827998721,,Wed Jan 16 12:35:17 +0000 2019,27986,47173,121,False,27,govt showing positive steps suddenly silence goa matters making dependant fearful faith hon pm cm kept going hope trust reposed yield fruits,Goa India,0,10,0,0
1085515318930231296,defence minister fin min responding,Wed Jan 16 12:33:14 +0000 2019,46087,37344,1349,False,18,defence minister fin min responding minute detail queries weed sanki ur dont understand response ur others,Mumtaz Occupied WB (India) ,0,6,0,0
1085514855635808256,demanding our rights rights arrest us shame,Wed Jan 16 12:31:24 +0000 2019,2342,775,13,False,3,demanding our rights rights arrest us shame,Unknown,2,2,0,0
1085513869810757632,india takes huge strides towards gas economy via namo app,Wed Jan 16 12:27:29 +0000 2019,1156,2452,37790,False,1,india takes huge strides towards gas economy via namo app,BIHAR,0,3,0,0
1085513474665521154,attack issue corruption th…,Wed Jan 16 12:25:54 +0000 2019,140726,79758,2800,False,1,attack issue corruption rest assured india corruption anything else hut list scams,Unknown,0,7,0,0
1085511835107745793,nishant verma ur senior citizen ur lingo leaves lot desired assure much,Wed Jan 16 12:19:23 +0000 2019,943,804,9,False,6,nishant verma ur senior citizen ur lingo leaves lot desired assure much lick going nothing pm,chennai,0,2,0,0
1085511678253588480,,Wed Jan 16 12:18:46 +0000 2019,85075,94610,640,False,1,congress party licking spit,INDIA,0,10,0,0
1085510490665693184,want ops,Wed Jan 16 12:14:03 +0000 2019,61,77,4,False,13,want ops,Unknown,0,6,0,0
1085510415608508422,govt decimated economy root cause decimation destruction our institutions.…,Wed Jan 16 12:13:45 +0000 2019,136,76018,278,False,43,govt decimated economy root cause decimation destruction our institutions destroyed institutions gave everything have… our economy grew sound economic principles wiped out.”,Rajnandgaon India,0,2,0,0
1085509959851347969,linked jean dreze nac run,Wed Jan 16 12:11:56 +0000 2019,11682,103917,789,False,1,linked jean dreze nac run sonia,Unknown,0,4,0,0
1085508207638863873,modi improved country’s image vi…,Wed Jan 16 12:04:59 +0000 2019,2778,3475,73,False,2,modi improved country’s image stageworld marketing summit wms)&amp;philip kotler,Andhra Pradesh India,0,8,0,0
1085507451208847361,indias top researchers jail india shame,Wed Jan 16 12:01:58 +0000 2019,39,519,26,False,2,indias top researchers jail india shame,Dhanbad,2,2,0,0
1085506653212930051,lol confused good,Wed Jan 16 11:58:48 +0000 2019,2424,119984,4651,False,1,lol confused good,कपकोट !बागेश्वर! उत्तराखंड !हि,0,6,0,0
1085502708461662209,kotler disgraceful act part trying disrepute honour conferred ji…,Wed Jan 16 11:43:08 +0000 2019,33193,14634,485,False,3,kotler disgraceful act part trying disrepute honour conferred ji dynastic clown digest admiration adulation our pm receives worldover hence resorts cheap tactics,Stockton CA,0,3,0,0
1085502396346785792,tried create fake narrative tight thurderous slap,Wed Jan 16 11:41:53 +0000 2019,5018,4173,155,False,1,tried create fake narrative tight thurderous slap,Mesopotamiya,0,5,0,0
1085489775937814528,please help us,Wed Jan 16 10:51:44 +0000 2019,168,157,14,False,5,please help us,Unknown,0,9,0,0
1085487306218209285,,Wed Jan 16 10:41:55 +0000 2019,70,142,3,False,30,please sir help us want qualified candidates post,Allahabad India,0,9,0,0
1085480983086850050,outstanding leadership tireless energy’ philip kotler award pm tight slap,Wed Jan 16 10:16:48 +0000 2019,21296,7024,76,False,2,outstanding leadership tireless energy’ philip kotler award pm tight slap fake news peddlers,Mumbai India,0,3,0,0
1085480694460047361,prakashji research students iacs sitting road de…,Wed Jan 16 10:15:39 +0000 2019,5,85,5,False,1,prakashji research students iacs sitting road demand fellowship hike last hike done please consider,Unknown,0,5,0,0
1085474991531995136,,Wed Jan 16 09:52:59 +0000 2019,51,138,4,False,2,gaining currency manipulation crude control market days ago crude price corrupted politicians making money election,Kolkata India,0,10,0,0
1085474500995497984,karyakartas launch electoral war got whattsapp forward pm years,Wed Jan 16 09:51:02 +0000 2019,1285,1372,234,False,3855,karyakartas launch electoral war got whattsapp forward pm years mahadeven* mts.” nonstop india,Unknown,0,2,0,0
1085471387010031616,useless moreon vultures getting chance steal piece,Wed Jan 16 09:38:40 +0000 2019,3422,108764,4418,False,1,useless moreon vultures getting chance steal piece consolidated coffers country stoop lowest chaiwala called royal dynast shaming country self,Gummidipoondi(T.N.) India,0,6,0,0
1085465831692152834,often calls chor tell thief,Wed Jan 16 09:16:35 +0000 2019,21224,13974,1283,False,1,often calls chor tell thief,Uttar Pradesh India,1,5,0,0
1085463659999100928,,Wed Jan 16 09:07:58 +0000 2019,27986,47173,121,False,10,thank save our restart,Goa India,0,10,0,0
1085462051487531008,yesterday president kovind ji signed passed to…,Wed Jan 16 09:01:34 +0000 2019,171,131,7,False,1,yesterday president kovind ji signed passed today state pass thr state state show courage,New Delhi India,0,4,0,0
1085461853839347712,,Wed Jan 16 09:00:47 +0000 2019,704,329,20,False,6,think position chancellor post speaks volumes sense intelligence shouldn’t ignorant domain chancellor fixed tenure refused,Unknown,0,10,0,0
1085461092342661120,keep quiet particular award nasty comment personally congratulate ji thi…,Wed Jan 16 08:57:45 +0000 2019,8329,3489,79,False,17,keep quiet particular award nasty comment personally congratulate ji prestigious award nasty comment anyone particularly rajiv gandhi ji longer amongst us good taste,Chandigarh India,0,2,0,0
1085458778428829696,expose shameful,Wed Jan 16 08:48:34 +0000 2019,6791,153728,31590,False,2,expose shameful,Mumbai india,1,6,0,0
1085457920089714688,philip kotler endorses award pm international thug,Wed Jan 16 08:45:09 +0000 2019,28765,18001,2846,False,2,philip kotler endorses award pm international thug tried run via,Lusiana Veneto Italy,0,3,0,0
1085456106149662720,supporter face humiliation,Wed Jan 16 08:37:57 +0000 2019,11453,6664,290,False,1,supporter face humiliation,फज़िल्का भारत,0,5,0,0
1085456063086891008,mr pm urself ur mother whole leadership driven fear fear getti…,Wed Jan 16 08:37:46 +0000 2019,391733,455405,23594,False,243,mr pm urself ur mother whole leadership driven fear fear getting exposed jailed scams lacs crores divert attention ur party leaders continuously spreading lies help paid media,Sri Ram NiwasPawan Putra Dham,0,4,0,0
1085455541302947841,thank commitment issue hey listening called,Wed Jan 16 08:35:42 +0000 2019,13599,4053,161,False,5,thank commitment issue hey listening called inch chest,Al Batinah Oman,0,3,0,0
1085453658081263616,parliament place meet wishes aspirations pays temple…,Wed Jan 16 08:28:13 +0000 2019,2121,2112,15,False,1817,parliament place meet wishes aspirations pays temple democracy parliament place idiotic watch comparative video,Unknown,0,3,0,0
1085452740854272000,,Wed Jan 16 08:24:34 +0000 2019,15455,15665,139,False,1,everything fake regarding chowkidaar,Aligarh India,0,10,0,0
1085452153106427909,philip kotler admitted pm modi economic social revolution…,Wed Jan 16 08:22:14 +0000 2019,11019,10753,49,False,1,philip kotler admitted pm modi economic social revolution india,Unknown,0,4,0,0
1085447904410488832,help please,Wed Jan 16 08:05:21 +0000 2019,1975,9133,203,False,7,help please,India,0,9,0,0
1085447394005667842,lolwa,Wed Jan 16 08:03:20 +0000 2019,23363,22726,219,False,1,lolwa,DELHIINDIA,0,6,0,0
1085447270496034817,lol pad lo,Wed Jan 16 08:02:50 +0000 2019,23363,22726,219,False,1,lol pad lo,DELHIINDIA,0,7,0,0
1085447188535115776,thank sir clarification understanding award indian,Wed Jan 16 08:02:31 +0000 2019,23363,22726,219,False,1,thank sir clarification understanding award indian opposition ji much ji,DELHIINDIA,0,4,0,0
1085446891356151810,dear pm modi ji please follow friend lies,Wed Jan 16 08:01:20 +0000 2019,207265,77184,1518,False,46,dear pm modi ji please follow friend lies,Noida India,1,3,0,0
1085446784141406208,tweeting doesnt sarcasm show jealousy pm rg so…,Wed Jan 16 08:00:54 +0000 2019,18541,17633,147,False,29,tweeting doesnt sarcasm show jealousy pm rg childish anyways use explaining anything wont understand sir keep good work proud,Maharashtra India,0,3,0,0
1085446556034068480,misunderstanding awards presented mr modi fake any…,Wed Jan 16 08:00:00 +0000 2019,23363,22726,219,False,1,misunderstanding awards presented mr modi fake awards presented genuine indian media,DELHIINDIA,0,5,0,0
1085446168446853121,mr family getting award ow…,Wed Jan 16 07:58:27 +0000 2019,23363,22726,219,False,1,mr family getting award influences our ji whatever feel don’t talk front media it’s good can’t answer single question years uae,DELHIINDIA,0,6,0,0
1085445340566679552,sir thanks lot msg unfortunately people peanut size,Wed Jan 16 07:55:10 +0000 2019,23363,22726,219,False,2,sir thanks lot msg unfortunately people peanut size,DELHIINDIA,0,4,0,0
1085445293523447808,,Wed Jan 16 07:54:59 +0000 2019,23363,22726,219,False,2,improve knowledge award pm,DELHIINDIA,0,9,0,0
1085444304326209537,happy enlightened en…,Wed Jan 16 07:51:03 +0000 2019,23363,22726,219,False,1,happy enlightened,DELHIINDIA,0,8,0,0
1085444290904416256,pappus enlightment,Wed Jan 16 07:51:00 +0000 2019,23363,22726,219,False,1,pappus enlightment,DELHIINDIA,0,7,0,0
1085443953422360582,pappuman jumped god marketing pained wh…,Wed Jan 16 07:49:39 +0000 2019,23363,22726,219,False,1,pappuman jumped god marketing pained fellow pappu talking marketing man life,DELHIINDIA,0,7,0,0
1085443194131689473,tell thing much money given work,Wed Jan 16 07:46:38 +0000 2019,6751,5212,2054,False,1,tell thing much money given work,Satara Maharashtra India,0,4,0,0
1085443112174927873,little paid media understand phil…,Wed Jan 16 07:46:19 +0000 2019,23363,22726,219,False,1,little paid media understand philip kotler nonetheless act stooping low underrating kotler award presented our modiji taste mr kotler clarify twice unfortunate,DELHIINDIA,0,5,0,0
1085443076791758848,reply unlike nehru dynast reward sel…,Wed Jan 16 07:46:10 +0000 2019,23363,22726,219,False,1,reply unlike nehru dynast reward selected,DELHIINDIA,0,6,0,0
1085442550880600064,lutyen media nurtured,Wed Jan 16 07:44:05 +0000 2019,23363,22726,219,False,1,lutyen media nurtured,DELHIINDIA,0,8,0,0
1085442327026401280,award pm award nation means rahul criticising pm pulli…,Wed Jan 16 07:43:11 +0000 2019,23363,22726,219,False,1,award pm award nation means rahul criticising pm pulling nation pm think come may wants country,DELHIINDIA,0,4,0,0
1085442251860238336,confusion attempt our pms achievements par…,Wed Jan 16 07:42:54 +0000 2019,23363,22726,219,False,1,confusion attempt our pms achievements particularly propagated couldn’t digest fact else awarded our pm award family known confer awards marketed media,DELHIINDIA,0,4,0,0
1085442206117158912,clown prince called can’t digest recognition given the…,Wed Jan 16 07:42:43 +0000 2019,23363,22726,219,False,1,clown prince called can’t digest recognition given pm india oppose defame india indians loves hug parliament,DELHIINDIA,0,5,0,0
1085442182050246656,dear sir legend grew ur dont worry,Wed Jan 16 07:42:37 +0000 2019,23363,22726,219,False,1,dear sir legend grew ur dont worry indian media zero iq extremely power hungry thankyou regards hardworking,DELHIINDIA,0,5,0,0
1085439269714284544,pappuji hope read interview send you…,Wed Jan 16 07:31:03 +0000 2019,23363,22726,219,False,1,pappuji hope read interview send voice recording read fun good stuff,DELHIINDIA,0,6,0,0
