id_str,full_text,created_at,favourites_count,statuses_count,followers_count,retweeted,retweet_count,retweeted_text,location,hashtags,user_mentions,symbols,urls
1085439245001650176,need chance heard demand justified,Wed Jan 16 07:30:57 +0000 2019,20,9558,50,False,27,need chance heard demand justified,Unknown,0,5,0,0
1085438401971654656,imv akin cutting ones nose spite face consigning ele…,Wed Jan 16 07:27:36 +0000 2019,11386,13629,1097,False,2,imv akin cutting ones nose spite face consigning electoral thugs veterans imagine theyll want keep dreaming,Gurgaon India,0,3,0,0
1085437499189555201,philip endorses award pm tried run congressi cant tol…,Wed Jan 16 07:24:00 +0000 2019,7869,82936,4396,False,7,philip endorses award pm tried run congressi cant tolerate good thing pm,DarkWorld ,0,4,0,0
1085436892235984896,guy cheated dept got slapped notice questioning honest pm paid media’s…,Wed Jan 16 07:21:36 +0000 2019,2843,2612,61,False,2,guy cheated dept got slapped notice questioning honest pm paid media’s supporting tat poor guy,भारत,0,2,0,0
1085436252709564417,important something pocs…,Wed Jan 16 07:19:03 +0000 2019,24,408,10,False,5,important something pocso speak request help address engage support,New Delhi India,0,7,0,0
1085434825513885696,uttering word congress mp party shame you.full months work to…,Wed Jan 16 07:13:23 +0000 2019,43923,38048,112,False,2,uttering word congress mp party shame you.full months work talk congress relevant theatrical speeches,Unknown,0,2,0,0
1085433962535673856,thanks recognizing our pm nation person the…,Wed Jan 16 07:09:57 +0000 2019,38958,41490,480,False,1,thanks recognizing our pm nation person name yearns pm india think award sham think,Gujarat India,0,3,0,0
1085430742669291521,sir please explain defination selfless service rendered shri mr,Wed Jan 16 06:57:10 +0000 2019,2056,1673,28,False,1,sir please explain defination selfless service rendered shri mr,Unknown,0,5,0,0
1085429337392701440,kotler whose name award leaderdhip conferred,Wed Jan 16 06:51:34 +0000 2019,8787,242269,2547,False,4,kotler whose name award leaderdhip conferred plethora losers cried oceans jealousy mahaghat ghats ganga polluting river clarified zeroed modi jury,ÜT: 19.17412172.834739,0,4,0,0
1085429006344675328,please read seven lines easy read help someone ca…,Wed Jan 16 06:50:16 +0000 2019,2055,2201,32,False,1,please read seven lines easy read help someone case difficulty,India,0,4,0,0
1085426370337955840,happy our pm narendra modi ji wishing good health happiness always,Wed Jan 16 06:39:47 +0000 2019,136,76018,278,False,7769,happy our pm narendra modi ji wishing good health happiness always,Rajnandgaon India,0,2,0,0
1085425828966658048,please remove month know vary our…,Wed Jan 16 06:37:38 +0000 2019,329,1266,264,False,1,please remove month know vary our felling regard india single association,DelhiIndia,0,4,0,0
1085424275719254016,pol…,Wed Jan 16 06:31:28 +0000 2019,21,77324,47,False,5,politicians hand glove nsel fraud give justice moons,Mumbai India,0,10,0,0
1085417990315798530,islam literally means peace allah nonestand force violence gandhiji picked…,Wed Jan 16 06:06:29 +0000 2019,1153,5424,5297,False,7,islam literally means peace allah nonestand force violence gandhiji picked idea nonviolence ancient indianphilosophy islamchristianityjudaism something,New Delhi India ,0,2,0,0
1085416636012736512,day,Wed Jan 16 06:01:06 +0000 2019,63,1042,9,False,45,day,Unknown,2,8,0,0
1085416556006465537,want,Wed Jan 16 06:00:47 +0000 2019,4185,2432,104,False,29,want pension scheme,Unknown,0,10,0,0
1085413377629962245,adat se,Wed Jan 16 05:48:09 +0000 2019,10203,119244,22346,False,1,adat se,दिल्ली / बिहार ,0,6,0,0
1085412415150399489,information marketing guru saying hims…,Wed Jan 16 05:44:20 +0000 2019,2049,101084,13058,False,1,information marketing guru saying modi ji people family confered ratna upon everything earned world lucky,Kashi Bharat Varsha,0,5,0,0
1085408282951471104,ohk thing cant expect hi tackle span…,Wed Jan 16 05:27:55 +0000 2019,20609,6926,2429,False,1,ohk thing cant expect hi tackle span years youre focusing negative things lot positive things changes around support,Kanpur India,0,5,0,0
1085405998913863683,dont know rahul lip sync whatever written given don…,Wed Jan 16 05:18:50 +0000 2019,18383,16985,249,False,1,dont know rahul lip sync whatever written given dont give much guy,Unknown,0,4,0,0
1085403903410257927,,Wed Jan 16 05:10:31 +0000 2019,24123,42085,257,False,3,,Mumbai,0,6,0,1
1085402012362121218,dear kind performance gets got,Wed Jan 16 05:03:00 +0000 2019,42,49,3,False,1,dear kind performance gets got,India,2,3,0,0
1085401644639141888,kindly degrees twitter…,Wed Jan 16 05:01:32 +0000 2019,220057,231448,779,False,4,kindly degrees twitter shut people need yr certificate degrees let us know got admission st stephens cutoff,vijayawada andhrapradesh india,0,8,0,0
1085400665206259712,sir wasnt us indians unfortunate lies sp…,Wed Jan 16 04:57:39 +0000 2019,93776,69043,5840,False,3,sir wasnt us indians unfortunate lies spread around serial liar clarify,PATIALA,0,4,0,0
1085398767988363267,ur family awarding ratna generations ji somet…,Wed Jan 16 04:50:06 +0000 2019,30546,16964,29,False,1,ur family awarding ratna generations ji something,Unknown,0,3,0,0
1085396346868244482,please help csat victims.we waiting justice our attempts were…,Wed Jan 16 04:40:29 +0000 2019,801,868,5,False,8,please help csat victims.we waiting justice our attempts wasted csat,Kolkata India,0,5,0,0
1085396322763632641,please listen grievances upsc aspirants years hard work they…,Wed Jan 16 04:40:23 +0000 2019,801,868,5,False,41,please listen grievances upsc aspirants years hard work theyre victim wrong officials policies theyre streets seeking support give justice,Kolkata India,0,4,0,0
1085393434519748608,,Wed Jan 16 04:28:55 +0000 2019,73943,176131,484,False,1,turn woman next prime minister india.women tohead nations states offices organizations gender equality justice empowerment honor dignity,GURGAON,1,9,0,0
1085393417935511553,use corruption top agenda loot vikash corruption ends,Wed Jan 16 04:28:51 +0000 2019,73943,176131,484,False,1,use corruption top agenda loot vikash corruption ends guilty failed violated endcorruption,GURGAON,0,3,0,0
1085392208293965824,corrupt defiant people guilty failed violated committed…,Wed Jan 16 04:24:02 +0000 2019,73943,176131,484,False,1,corrupt defiant people guilty failed violated committed offence contempt corrupt top court orders antijudiciary antifemales antifarmers antipeaceanticonstitution ravanraj sins,GURGAON,1,3,0,0
1085387756900175872,mr kotler ruckus created moron dynast,Wed Jan 16 04:06:21 +0000 2019,498,498,5,False,6,mr kotler ruckus created moron dynast media team guys run lots fake news india tarnish modi image,Unknown,0,6,0,0
1085387373301690368,important isue,Wed Jan 16 04:04:49 +0000 2019,176,876,41,False,1,important isue,India,0,7,0,0
1085387346621665280,important something pocso sp…,Wed Jan 16 04:04:43 +0000 2019,176,876,41,False,1,important something pocso speaks request help address engage support,India,0,7,0,0
1085384890298888194,philip kotler congratulates pm presidential award,Wed Jan 16 03:54:57 +0000 2019,9380,12417,188,False,1,philip kotler congratulates pm presidential award,Unknown,0,4,0,0
1085383826912743431,,Wed Jan 16 03:50:44 +0000 2019,1214,7710,870,False,2,years congress govt shame vote,Unknown,0,10,0,0
1085383498339356672,,Wed Jan 16 03:49:26 +0000 2019,3921,4871,78,False,22,act late,Junagad India,0,11,0,0
1085380669470134272,want degree holders allow forjunior engineer posts,Wed Jan 16 03:38:11 +0000 2019,154,178,3,False,20,want degree holders allow forjunior engineer posts,Unknown,1,3,0,0
1085378121870860288,don’t care guy questions surgical strike efforts indi…,Wed Jan 16 03:28:04 +0000 2019,53488,66504,1979,False,1,don’t care guy questions surgical strike efforts indian army indian raga wants indian airforce weaker wants eurofighter jets rafael people support pakistan nationalist,New Delhi India,0,5,0,0
1085377921542438917,true need give chances years ne…,Wed Jan 16 03:27:16 +0000 2019,39453,29778,641,False,1,true need give chances years india,India,0,6,0,0
1085376562420203521,congress development,Wed Jan 16 03:21:52 +0000 2019,47,32,8,False,2,congress development,Unknown,0,8,0,0
1085376487644192769,contractual employees sitting regularly dharna days on…,Wed Jan 16 03:21:34 +0000 2019,4,37,0,False,1,contractual employees sitting regularly dharna days dtc head quater legal demand done illigal terminate employees terminate employ file case court loss,Shahdara New Delhi,1,5,0,0
1085375135471861760,love cant rahulji’s modiji,Wed Jan 16 03:16:12 +0000 2019,25945,16902,301,False,2,love cant rahulji’s modiji,India ,0,4,0,0
1085374582796832770,sir mocked tweet please respond understand dif…,Wed Jan 16 03:14:00 +0000 2019,34,1885,462,False,1,sir mocked tweet please respond understand difficult please try,New Delhi,0,5,0,0
1085373503258398720,know niyat pappu italian slaves corruption and…,Wed Jan 16 03:09:43 +0000 2019,9506,8673,91,False,1,know niyat pappu italian slaves corruption loot india motto shameless dynasty family party,Banglore,0,5,0,0
1085373389718470656,dont worry confusion created childishness rahul gan…,Wed Jan 16 03:09:16 +0000 2019,44896,47659,368,False,11,dont worry confusion created childishness rahul gandhi clue things kids throw tantrum dont toy shame dadi mommy cant everything,BostonUS,0,4,0,0
1085372154198126593,please care issue,Wed Jan 16 03:04:21 +0000 2019,74,328,38,False,1,please care issue,Mumbai,0,5,0,1
1085369121728978945,real fake,Wed Jan 16 02:52:18 +0000 2019,221,231,88,False,2,real fake,Kerala India,0,4,0,0
1085368739720093696,,Wed Jan 16 02:50:47 +0000 2019,4679,2802,59,False,24,time govt should intervene matter infuse funds atleast start construction,Unknown,1,9,0,0
1085366401664192512,,Wed Jan 16 02:41:29 +0000 2019,16,234,19,False,11,pls restore pension scheme,Unknown,0,10,0,0
1085364686625730561,,Wed Jan 16 02:34:41 +0000 2019,93415,84520,19186,False,1,true shows corruption runs deep media gonna clean wanna clean call attack freedom speech,Cawnpore,0,10,0,0
1086039121741651968,real challenge,Thu Jan 17 23:14:38 +0000 2019,9903,43796,1478,False,4,real challenge,Unknown,4,4,0,0
1085997045737910273,congrats hats indian government leading country suc…,Thu Jan 17 20:27:27 +0000 2019,62,1537,142,False,1,congrats hats indian government leading country trustworthy manner,India,0,6,0,0
1085975499325747205,rally lal chowk telling people work done pm shri ji government kar…,Thu Jan 17 19:01:50 +0000 2019,465941,513161,4947,False,468,rally lal chowk telling people work done pm shri ji government kargil people happy ji tunnel issue,New Delhi India,3,2,0,0
1085966763387367427,years challenge ji change india developed india villages,Thu Jan 17 18:27:07 +0000 2019,3950,2322,149,False,1,years challenge ji change india developed india villages,Tamil Nadu India,3,2,0,0
1085933587906682880,pm flagship healthcare scheme yojana gets appreciation none,Thu Jan 17 16:15:17 +0000 2019,110916,29664,362,False,11,pm flagship healthcare scheme yojana gets appreciation none,Bidar India,1,3,0,0
1085928843943206912,online voting prime minister election voted click vote,Thu Jan 17 15:56:26 +0000 2019,132,456,71,False,138,online voting prime minister election voted click vote,Unknown,0,2,0,0
1085926569049276416,listen man our pm ji please shun support get…,Thu Jan 17 15:47:24 +0000 2019,2926,3289,28,False,1,listen man our pm ji please shun support set vote convince others vote hope,India,3,2,0,0
1085923913949798401,creating level playing field http…,Thu Jan 17 15:36:51 +0000 2019,2124,25766,30164,False,64,creating level playing field,Patna India,5,2,0,0
1085912532496404485,governments topmost importance growth,Thu Jan 17 14:51:37 +0000 2019,223,98,48,False,6,governments topmost importance growth,Unknown,5,2,0,0
1085907609209565186,namo means man developing india fan/ ji pm india,Thu Jan 17 14:32:03 +0000 2019,934,1282,123,False,1,namo means man developing india fan/ ji pm india,Chandigarh India,1,3,0,0
1085901791638638592,morning working noticed today fail,Thu Jan 17 14:08:56 +0000 2019,106945,264559,11131,False,15,morning working noticed today fail giving work sure, California.,0,4,0,0
1085887148941815810,live pm shri lays foundation stone inaugurates multiple development projects odisha…,Thu Jan 17 13:10:45 +0000 2019,2240,168973,8656,False,99,live pm shri lays foundation stone inaugurates multiple development projects odisha,आपके ❤ में,0,3,0,0
1085855565304098816,pm miss friends,Thu Jan 17 11:05:15 +0000 2019,10569,48670,1229,False,4,pm miss friends,Unknown,2,2,0,1
1085850578230566912,true ji matter good person always someone criticising yo…,Thu Jan 17 10:45:26 +0000 2019,515,517,2,False,30,true ji matter good person always someone criticising,Unknown,0,2,0,0
1085804005769527296,gdp inflation ji vs surp…,Thu Jan 17 07:40:22 +0000 2019,719,37752,3056,False,34,gdp inflation ji vs surprise madarasa chap economist know count economy india,India,3,4,0,0
1085795755988828160,team nayak meets pm know,Thu Jan 17 07:07:35 +0000 2019,13318,13866,159,False,3,team nayak meets pm know,Nayanda Halli Bengaluru,2,4,0,0
1085785722869624832,offering tanks january,Thu Jan 17 06:27:43 +0000 2019,183231,167902,1161,False,2,offering tanks january,Surat India,4,3,0,0
1085623262103699457,congratulations hon pm ji felicitated philip kotler presidential award proud day for…,Wed Jan 16 19:42:10 +0000 2019,25898,48103,2343,False,555,congratulations hon pm ji felicitated philip kotler presidential award proud day indians,India,0,2,0,0
1085622412874371072,request confer ratna,Wed Jan 16 19:38:47 +0000 2019,90,173,5,False,1,request confer ratna player hope militant secularism got peace enjoy mocking others showing reservation voting swine flu gandhi peace prize,Warangal-Hanamkonda India,2,4,0,0
1085597414403133440,talented met ji film delegation meeting,Wed Jan 16 17:59:27 +0000 2019,46775,62302,497,False,6,talented met ji film delegation meeting,Indore India,1,3,0,0
1085584380779671552,want justice danish zehen plz help us reopen case,Wed Jan 16 17:07:40 +0000 2019,4,7,2,False,1,want justice danish zehen plz help us reopen case request proper investigation much needed case,Unknown,0,4,0,0
1085579234943385600,proud little girl👧🏻 helping clean india mission,Wed Jan 16 16:47:13 +0000 2019,460,194,57,False,1,proud little girl👧🏻 helping clean india mission,Rajkot India,2,2,0,0
1085562561041297410,congratulations hon pm ji felicitated philip kotler presidential award proud day…,Wed Jan 16 15:40:57 +0000 2019,2324,3815,75,False,17,congratulations hon pm ji felicitated philip kotler presidential award proud day indians,Hoshiarpur India,0,2,0,0
1085559421265010689,karnads staggering forward sums failure,Wed Jan 16 15:28:29 +0000 2019,5672,41302,6443,False,2,karnads staggering forward sums failure page,இந்தியா | भारत | India,2,2,0,0
1085551250282733568,would understatement call development’ excels every…,Wed Jan 16 14:56:01 +0000 2019,6604,6657,2756,False,3,would understatement call development’ excels role ideal prime minister,26.8467° N 80.9462° E,0,2,0,0
1085523599572828160,pm inaugurated kollam today conceived indira gandhi government,Wed Jan 16 13:06:08 +0000 2019,18078,19863,130,False,76,pm inaugurated kollam today conceived indira gandhi government,Amethi India,1,2,0,0
1085478002777964546,rss replace modi amit shah nitin gadkari,Wed Jan 16 10:04:57 +0000 2019,695,1184,4,False,1,rss replace modi amit shah nitin gadkari,Unknown,1,5,0,0
1085380585835712513,narendra modi tuesday greeted soldiers occasion army day https:…,Wed Jan 16 03:37:51 +0000 2019,817,993,11,False,1,narendra modi tuesday greeted soldiers occasion army day,Unknown,3,2,0,0
1085360913916411904,came together met pm india delhi discuss theyll,Wed Jan 16 02:19:41 +0000 2019,23459,12247,56,False,40,came together met pm india delhi discuss theyll nation,Medan Indonesia,0,2,0,0
1085211022963687424,states develop mother india pranaam persistent focus east indian states our,Tue Jan 15 16:24:04 +0000 2019,2849,14051,3276,False,4,states develop mother india pranaam persistent focus east indian states our pm,Mumbai/UP,0,2,0,0
1085202249683472384,dont care middle class person doin…,Tue Jan 15 15:49:13 +0000 2019,10605,10788,297,False,1,dont care middle class person aspects,Bangalore,1,3,0,0
1085201577525182465,congratulations our pm ji felicitated philip kotler presidential award pr…,Tue Jan 15 15:46:32 +0000 2019,32819,34101,3011,False,22,congratulations our pm ji felicitated philip kotler presidential award proud day indians across,Delhi/ Jammu and (Kashmir) IND,0,2,0,0
1085175558714085376,modi sarkar done much middle class governments past.…,Tue Jan 15 14:03:09 +0000 2019,954,750,12,False,3,modi sarkar done much middle class governments past,India,1,2,0,0
1085155339203497984,inaugurate project circuit sree swamy temple aranmul…,Tue Jan 15 12:42:48 +0000 2019,44822,148546,1161,False,4,inaugurate project circuit sree swamy temple aranmula parthasarathy temple temple” today,Unknown,1,2,0,0
1085134338415419392,poster pm india narendra modi,Tue Jan 15 11:19:21 +0000 2019,2588,1405,2037,False,8,poster pm india narendra modi,New Delhi India,0,4,0,0
1085127791480164354,congratulations our pm ji felicitated philip kotler presidential award proud day al…,Tue Jan 15 10:53:20 +0000 2019,1602,5815,211,False,1,congratulations our pm ji felicitated philip kotler presidential award proud day,Unknown,0,2,0,0
1085126533574909952,fast lane auto sector growth proof sound growth,Tue Jan 15 10:48:20 +0000 2019,13918,14557,111,False,1,fast lane auto sector growth proof sound growth,भारत,0,3,0,1
1085126432450170880,,Tue Jan 15 10:47:56 +0000 2019,205664,48379,9601,False,17,hats sri ji giving instructions initiate search operation missing sri ji proved pm pradhan sewak,सुरत महानगर ,0,10,0,0
1085115478480044033,poster pm india narendra modi,Tue Jan 15 10:04:25 +0000 2019,62155,14773,9278,False,4,poster pm india narendra modi,बरेली उत्तर प्रदेश भारत।,0,5,0,0
1085102096318414848,name enough got indian lucky hard working honest pm,Tue Jan 15 09:11:14 +0000 2019,3104,20910,102,False,45,name enough got indian lucky hard working honest pm,Punjab India,0,3,0,0
1085077156152164353,proved today government historic day,Tue Jan 15 07:32:08 +0000 2019,217,168,6,False,14,proved today government historic day,Unknown,3,2,0,0
1085049635725467649,region good connectivity positively impacts sectors especially tourism sector pm…,Tue Jan 15 05:42:47 +0000 2019,7311,44010,1221,False,2,region good connectivity positively impacts sectors especially tourism sector pm shri,करौंदी-देवरिया Akhand Bharat,0,2,0,0
1085014845504638976,,Tue Jan 15 03:24:32 +0000 2019,21194,24127,477,False,2,clearly shows right pm india hardworking sir keep towards making great india,Unknown,0,9,0,0
1085010473358000128,ji felicitated philip kotler presidential award proud day indians congratulations,Tue Jan 15 03:07:10 +0000 2019,1478,428,44,False,1,ji felicitated philip kotler presidential award proud day indians congratulations pm india,India ,0,2,0,0
1085002081839140865,performing task expecting nitin gadkari next prime minister modi kee…,Tue Jan 15 02:33:49 +0000 2019,695,1184,4,False,1,performing task expecting nitin gadkari next prime minister modi keep lie ing fake promises lose strength,Unknown,0,3,0,0
1084989250163171328,poster pm india narendra modi,Tue Jan 15 01:42:50 +0000 2019,6931,8410,178,False,8,poster pm india narendra modi,Delhi India ,0,5,0,0
1084965707878588418,lop dr kharge ji slams pm result coalition…,Tue Jan 15 00:09:17 +0000 2019,9637,11095,197,False,9,lop dr kharge ji slams pm result coalition should think speaking,Bidar,2,3,0,0
1084857390741082112,hope india realises,Mon Jan 14 16:58:52 +0000 2019,4416,6488,96,False,1,hope india realises,payakaraopeta,4,3,0,0
1084805726160080896,congratulations hon pm ji felicitated philip kotler presidential award,Mon Jan 14 13:33:34 +0000 2019,10413,24151,644,False,1,congratulations hon pm ji felicitated philip kotler presidential award,India,0,1,0,0
1084802065971535872,voters choose govt modi govt attacks pm,Mon Jan 14 13:19:01 +0000 2019,7744,11024,363,False,8,voters choose govt modi govt attacks pm,Chandni Chowk New Delhi,0,3,0,0
1084797802318909440,credit should given powerful yadavas touching feet dalit good,Mon Jan 14 13:02:05 +0000 2019,69,1230,83,False,1,credit should given powerful yadavas touching feet dalit good realized place time indeed social equation changing,noida,0,2,0,0
1084791252309209089,congratulations hon pm ji felicitated philip kotler presidential award,Mon Jan 14 12:36:03 +0000 2019,31520,25505,1139,False,1,congratulations hon pm ji felicitated philip kotler presidential award proud day indians,Chandigarh India,0,3,0,0
1084674801203957760,congratulations finally amendment pass,Mon Jan 14 04:53:19 +0000 2019,81,756,13,False,1,congratulations finally amendment pass,Unknown,2,2,0,0
1084674748368502785,ji speaking,Mon Jan 14 04:53:06 +0000 2019,81,756,13,False,1,ji speaking,Unknown,3,2,0,0
1084674539236163586,sirs determination introduce good governance help digitalization positive change…,Mon Jan 14 04:52:17 +0000 2019,81,756,13,False,1,sirs determination introduce good governance help digitalization positive change india thanks solving needy within fraction time,Unknown,0,2,0,0
1084636456587382785,please look matter salary dues pe…,Mon Jan 14 02:20:57 +0000 2019,3172,2119,42,False,3,please look matter salary dues pending act destroyed employments industry,Alwar India,0,5,0,0
1084627751447945216,thank much wish ji,Mon Jan 14 01:46:22 +0000 2019,114254,126933,3136,False,30,thank much wish ji,India,3,3,0,0
1084502323114766342,pm today launched scathing attack failure gurdwara kartarpur,Sun Jan 13 17:27:57 +0000 2019,30924,31649,202,False,10,pm today launched scathing attack failure gurdwara kartarpur partition,India,0,3,0,0
1084490614266388481,must taking acting lessons pm narendra modi,Sun Jan 13 16:41:25 +0000 2019,1078,48,1,False,1,must taking acting lessons pm narendra modi,New Delhi India,2,3,0,0
1084419629760471040,removed chief done would removed pm,Sun Jan 13 11:59:21 +0000 2019,136,76018,278,False,4,removed chief done would removed pm post,Rajnandgaon India,1,2,0,0
1084358352031739904,pm release commemorative coin mark anniversary delhi today pm…,Sun Jan 13 07:55:52 +0000 2019,25388,11788,1198,False,2,pm release commemorative coin mark anniversary delhi today pm address gathering occasion,Nuapada India tarbod,1,2,0,0
1084338468556201984,next time speak contact hand,Sun Jan 13 06:36:51 +0000 2019,39161,887,354,False,1,next time speak contact hand,Chitradurga India,3,3,0,0
1084272321995657218,support,Sun Jan 13 02:14:01 +0000 2019,180,1576,12,False,11,support,Unknown,5,2,0,0
1084225908171554817,alternate dont vote,Sat Jan 12 23:09:35 +0000 2019,140176,90625,337,False,36,alternate dont vote,Unknown,3,2,0,0
1084113722161819653,film industry delegation meets pm various issues concerning film industry discussed,Sat Jan 12 15:43:47 +0000 2019,6712,7175,257,False,4,film industry delegation meets pm various issues concerning film industry discussed,Unknown,1,2,0,0
1084071778627084294,dear pm dear allowing students sit difficult kindly gra…,Sat Jan 12 12:57:07 +0000 2019,8410,11588,90,False,53,dear pm dear allowing students sit difficult kindly grant listen,Unknown,1,3,0,0
1084061702776328192,cm expressed amusement pm clerk saying pm reacting ru…,Sat Jan 12 12:17:05 +0000 2019,302084,457409,3084,False,1,cm expressed amusement pm clerk saying pm reacting rumours added reacting false information time comment,Bengaluru India,1,3,0,0
1084056800171704320,shri shri addressed huge gathering,Sat Jan 12 11:57:36 +0000 2019,5012,5443,169,False,1,shri shri addressed huge gathering party’s ongoing delhi’s…,Unknown,4,2,0,0
1084021362325303296,shri shri today today met exchanged year greeti…,Sat Jan 12 09:36:47 +0000 2019,5012,5443,169,False,1,shri shri today today met exchanged year greetings pmo officials spg personnel lok kalyan marg.…,Unknown,3,2,0,0
1084012025519296513,petrol diesel prices rise,Sat Jan 12 08:59:41 +0000 2019,180,324,26,False,1,petrol diesel prices rise,Unknown,4,5,0,0
1084001966966038528,comparison pm foreign trip went world,Sat Jan 12 08:19:43 +0000 2019,1015,4253,629,False,6,comparison pm foreign trip went world pm touring world money without,India,1,3,0,0
1083950753880825857,arise awake stop till win,Sat Jan 12 04:56:13 +0000 2019,559,55,9,False,1,arise awake stop till win,Unknown,4,2,0,0
1083922838720000001,joy meet prime minister our great nation,Sat Jan 12 03:05:17 +0000 2019,15796,17083,134,False,4,joy meet prime minister our great nation,Bahrain,1,3,0,0
1083900817302872064,picture day our sid our pm ji,Sat Jan 12 01:37:47 +0000 2019,23656,34315,3658,False,5,picture day our sid our pm ji,Mars ,3,3,0,0
1083840178425290752,elections versus president national convention follow live…,Fri Jan 11 21:36:49 +0000 2019,248,307,182,False,20,elections versus president national convention follow live updates,Unknown,0,3,0,0
1083816252697587712,,Fri Jan 11 20:01:45 +0000 2019,1592,1358,371,False,5,today privilege meet pm ji requested speedup search operation missing malpe india fishermen association thankful ji accepting our request,Jalgaon Maharashtra India,0,10,0,0
1083775382212341760,leader,Fri Jan 11 17:19:21 +0000 2019,5750,8458,56,False,1,leader,Unknown,2,3,0,0
1083770627704537088,young delegation film industry pm,Fri Jan 11 17:00:27 +0000 2019,565,1751,155,False,46,young delegation film industry pm details,Unknown,3,3,0,0
