id_str,full_text,created_at,favourites_count,statuses_count,followers_count,retweeted,retweet_count,retweeted_text,location,hashtags,user_mentions,symbols,urls
1082666366031798274,"@TajinderBagga @pummy863 There is as simple reason, however great crimes committed by High &amp; Mighty Politicians or Family controlled polity, they are not to be touched.",Tue Jan 08 15:52:31 +0000 2019,35407,17404,6215,False,0,,Okha Port भारत,8,2,0,0
1082666074523484164,"@madhusharmabjp @sandeepfromvns There is as simple reason, however great crimes committed by High &amp; Mighty Politicians or Family controlled polity, they are not to be touched.",Tue Jan 08 15:51:21 +0000 2019,35407,17404,6215,False,0,,Okha Port भारत,8,2,0,0
1082665802384457730,"@jagratishuklafc @atlantesindia There is as simple reason, however great crimes committed by High &amp; Mighty Politicians or Family controlled polity, they are not to be touched.",Tue Jan 08 15:50:16 +0000 2019,35407,17404,6215,False,0,,Okha Port भारत,8,2,0,0
1082665708671156225,"There is as simple reason, however great crimes committed by High &amp; Mighty Politicians or Family controlled polity, they are not to be touched.",Tue Jan 08 15:49:54 +0000 2019,35407,17404,6215,False,1,,Okha Port भारत,8,0,0,1
1082665546603261954,"There is as simple reason, however great crimes committed by High &amp; Mighty Politicians or Family controlled polity, they are not to be touched.",Tue Jan 08 15:49:15 +0000 2019,35407,17404,6215,False,0,,Okha Port भारत,8,0,0,1
1082664514598907906,"There is as simple reason, however great crimes committed by High &amp; Mighty Politicians or Family controlled polity, they are not to be touched.",Tue Jan 08 15:45:09 +0000 2019,1137,705,50,False,1,,Okha Port Hindusthan,8,0,0,1
1082491966078672897,"@padmakumar321 @surendranbjp @narendramodi @BJP4India Whether in 2014 or now he has done it. Not like congress who played cast based and minority card gimmick for win elections. You people never appreciate Modiji's good governance instead just try to find a fault in every aspect. ,",Tue Jan 08 04:19:31 +0000 2019,975,208,81,False,0,,Kunjathur India,3,4,0,0
1082351562142273539,@JhaSanjay Btw your party prez @RahulGandhi n r also tax frauds n they're on bail. Thuk k chaat na to CONgressi ghulam ka right hai lol @BJP4Karnataka,Mon Jan 07 19:01:36 +0000 2019,34463,26876,1687,False,0,,Unknown,6,3,0,0
1082339611278336000,@MockingSkills @BJP4India must not thnk dat @narendramodi Ji cn fix all corruptions/problems/issues/leakages wch r created by in one-term ( 5yrs ) It's now or nvr... So all true indians must brng him bck wid evn stronger majority 🙏🇮🇳,Mon Jan 07 18:14:06 +0000 2019,829,6839,32,False,0,,Under The Sea,4,3,0,0
1082267370356301824,Is is Right decision by,Mon Jan 07 13:27:03 +0000 2019,3076,14128,5090,False,0,,Muzaffarpur Bihar,17,0,0,0
1082262059910217728,"A humble Request!!! Dear Friend's , let's not lose friendship over politics. I make a wish this year May the bjp voters get son like @narendramodi and congress voters get a son like @RahulGandhi. Debate settled 🙏🙏🙏",Mon Jan 07 13:05:57 +0000 2019,7,234,1393,False,1,,Unknown,2,2,0,0
1082236313372246017,@prashantkgf @DrGPradhan @HarshalIdea @mrudulalele Congratulations &amp; all the best for kick start and kicking out the with win for with 375+seats...!!!,Mon Jan 07 11:23:38 +0000 2019,10063,13905,363,False,0,,Spectral Extant,10,4,0,0
1082232698398224385,PM @narendramodi ji @PMOIndia @AmitShah ji Does @drharshvardhan deserve to be in @BJP4India Cabinet? Sack him @RSSorg @sgurumurthy @sardesairajdeep @ShekharGupta @pnvijay @RakeshSinha01 @thesuniljain,Mon Jan 07 11:09:16 +0000 2019,9,1603,1,False,0,,Mumbai India,2,12,0,1
1082232051552657408,PM @narendramodi ji @PMOIndia @AmitShah ji @drharshvardhan is one of the most inefficient Minister in Cabinet? @RSSorg @sgurumurthy @sardesairajdeep @ShekharGupta @pnvijay @RakeshSinha01 @thesuniljain @BJP4India,Mon Jan 07 11:06:42 +0000 2019,9,1603,1,False,0,,Mumbai India,2,12,0,1
1082231816151617541,PM @narendramodi ji @PMOIndia @AmitShah ji This is very embarrassing. Pls consider sacking @drharshvardhan @RSSorg @sgurumurthy @sardesairajdeep @ShekharGupta @pnvijay @RakeshSinha01 @thesuniljain @BJP4India,Mon Jan 07 11:05:46 +0000 2019,9,1603,1,False,0,,Mumbai India,2,12,0,1
1082225369120292864,Govt moving forward with 10% for Economically backward upper castes 🙏 Keep hating b*%&amp;es !! 🔥👌🚀 @BJP4India @narendramodi @PMOIndia,Mon Jan 07 10:40:09 +0000 2019,1243,1045,1125,False,1,,Kochi,5,3,0,0
1082209242088538112,Great step against terrorism... Kudos to @narendramodi @BJP4India,Mon Jan 07 09:36:04 +0000 2019,1311,202,27,False,0,,Seoni India,6,2,0,1
1082200560005074945,CONGRESS KA DOGALAPAN RAFAEL DEAL PER DRAMA MISSION 19 VOTE N SUPPORT TO MODI AGAIN @INCIndia @BJP4UK,Mon Jan 07 09:01:34 +0000 2019,7304,3262,591,False,1,,Uttarkashi dehradun india,5,2,0,0
1082169750208208896,RT @EasyPeezyTweet: @Vyas241S @BJP4India @AmitShah @AmitShahOffice @amitmalviya @DrRutvij @thekernelspeaks @SaundiD @CongressDahan @UdaTaTi…,Mon Jan 07 06:59:08 +0000 2019,159869,381634,20123,False,2,@Vyas241S @BJP4India @AmitShah @AmitShahOffice @amitmalviya @DrRutvij @thekernelspeaks @SaundiD @CongressDahan @UdaTaTir @Bsharma7 @ibhagwa_n @CantstopulovinM @INCIndia @RahulGandhi @narendramodi Absolutely,गारियाधार जि भावनगर गुजरात ,0,10,0,0
1082168840979656705,"@TimesNow While I understand that coalition is a requirement, BJP will do well in Maharashtra without Shivsena. Many I know, have voted for Congress or Ncp in the past to avoid Shivsena though they want",Mon Jan 07 06:55:32 +0000 2019,162,559,77,False,2,,Mumbai,1,1,0,0
1082167196162449408,"I think NDA should stop explaining or answering UPA questions on because, it is confirmed that looters (congress party) never want india to be developed and thus our pappu can’t understand anything. ाओ_देश_बचाओ",Mon Jan 07 06:48:59 +0000 2019,584,231,35,False,0,,Belgaum Karnataka,5,0,0,0
1082151054660251648,Very well answered many folks about this biased so called “Factual” youtube journalist. Fact's doesn't include opinions. I hope we will more neutral journalism.,Mon Jan 07 05:44:51 +0000 2019,149,32,18,False,0,,Minneapolis MN,4,0,0,1
1082147489774534656,Subscribe to PewDiePie ❎ Vote for BJP in 2019 ☑️,Mon Jan 07 05:30:41 +0000 2019,3559,545,46,False,0,,Unknown,6,0,0,1
1082129178877517826,@Vyas241S @BJP4India @AmitShah @AmitShahOffice @amitmalviya @DrRutvij @thekernelspeaks @SaundiD @CongressDahan @UdaTaTir @Bsharma7 @ibhagwa_n @CantstopulovinM @INCIndia @RahulGandhi @narendramodi Absolutely,Mon Jan 07 04:17:55 +0000 2019,12796,22740,928,False,2,, India-Canada,5,16,0,0
1081975220167012352,"@RahulGandhi When you tell one lie, you need to keep spinning out more lies, to cover up the first one.",Sun Jan 06 18:06:09 +0000 2019,6911,6123,290,False,1,,India,9,1,0,1
1081971725905027072,"@RenukaJain6 @RahulGandhi These r &amp; they born with Q, they don't give any ans or they r not answerable 2 State or Nation @INCIndia @divyaspandana @KapilSibal @DrAMSinghvi @PChidambaram_IN @ahmedpatel",Sun Jan 06 17:52:16 +0000 2019,10063,13905,363,False,0,,Spectral Extant,9,8,0,0
1081827043451404289,This is congress Govt defense minister himself saying there was no budget to buy aircrafts as the funds allocated for the same was diverted ( Feb 2014) @INCIndia @BJP4India,Sun Jan 06 08:17:21 +0000 2019,4505,3939,305,False,0,,MumbaiIndia,3,2,0,1
1081809397997846528,"CONgress dumped by SP, BSP in UP. Three cornered fight will be beneficial for BJP. @BJP4India @AmitShah @narendramodi",Sun Jan 06 07:07:14 +0000 2019,1398,200368,5807,False,0,,India - Bharat - Hindustan,5,3,0,1
1081809126118744064,"CONgress dumped by SP, BSP in UP. Three cornered fight will be beneficial for BJP. @BJP4India @AmitShah @narendramodi",Sun Jan 06 07:06:09 +0000 2019,1398,200368,5807,False,0,,India - Bharat - Hindustan,5,3,0,1
1081770921000660992,@INCIndia as usual making Rajasthan another heaven of corruption Shame,Sun Jan 06 04:34:20 +0000 2019,17650,16450,152,False,0,,Hyderabad India,13,1,0,1
1081408339282718720,"@narendramodi ....Since independence, non-congress govt has Never got Re-elected ! ... ...pull up ur socks @BJP4India",Sat Jan 05 04:33:34 +0000 2019,16991,8451,1863,False,2,,India,2,2,0,0
1081193245835546624,@_sujyoti1 @hindustanse @barotchetan99 @daddachoubeyji @goldithakurzira @NationFirst0008 @shingarikabeau1 @VisitorA8Planet @narendramodi @ChaudhuryAlok @RajivRanjanRa16 @ParimalSheth @yadavdxb86 @yadav_sunil @Reshu00165856 @MrPandeyG @Santosh43800350 @me_and_my_crew_ @HyderabadiUstad @Satya_tweets__ @01_djbhatt @el_hanji @mishraji12111 @riteshadesai @kalevidyasagar @deanarayan @aditaythakur @Divyamshu_2010 @sherigara @milisilichilli @ankkinegi @akkiiboy @jeetensingh @Ajaiveer2 @iAadiRaj @Aaruoo7 4 Nation we should choose only Namo🙏 I nominate @ParasKGhelani @VoiceOfAxom @ParthaBezbar @baruahrana123 @OnlineRajan__ @RajendraRai1234 @sandeepfromvns @champ4561 @TheSupremeRahu @RohiniShah73 @CongressDahan @ankitasood13 @vanitajain21 @Ramesh_BJP,Fri Jan 04 14:18:52 +0000 2019,7931,97432,7178,False,19,,india..👰👸👯👼,2,50,0,0
1081134780027088901,"@News18India @INCIndia @RahulGandhi @BJP4India @RahulGandhi and his colleagues are'nt even ready 2 listen or understand the detailed justification presented by @nsitharaman, I am really fail 2 understand what they want prove, dis would really if win &amp; rule",Fri Jan 04 10:26:32 +0000 2019,351,1284,69,False,0,,India,5,6,0,0
1081118580043845632,@sandeep_chavda @RahulGandhi @smritiirani @Kishor_a @Deepali_p @ankitasood13 @manishkp243 @ghuge_hanuman @SharmaKhemchand @MithunRKumar2 @vinitgoenka @amitmalviya @aashish81us Only @BJP4India can bring about a positive change under Sri @ @narendramodi ji. Congress has been handicapped with only on gear of progress i.e. REVERSE.,Fri Jan 04 09:22:10 +0000 2019,19438,22771,1486,False,1,,Bangalore,3,15,0,0
1081057679139835904,"If Congress comes to the power in 2019, Hindus will very soon become minorities in their own homeland. @TajinderBagga @AsYouNotWish @BJP4India",Fri Jan 04 05:20:10 +0000 2019,938,952,62,False,0,,INDIA,3,3,0,0
1081041359245459457,People! Please be wise in casting your precious vote in ... we need good for the sake of country’s development @BJP4India we need to overcome and Ensure to lose at all cost!,Fri Jan 04 04:15:19 +0000 2019,2615,5805,64,False,0,,Gujarat India,8,1,0,1
1081034035676082178,India's external debt declines 3.6% to $510.4 billion at Sept-end via @economictimes,Fri Jan 04 03:46:13 +0000 2019,640,1241,224,False,0,,Unknown,10,1,0,1
1080870050444263424,@AnilJ_Modi19 @mgnayak5 @MukulAgarwal66 @arvind_joshi @masala_chaas @Online_Florista @PradnyaLotlikar @jvidyasagar @bhuvikal @jyotsnavarma9 @jyotsnadevi33 @mahendra3 @narendramodi @sandeepfromvns @CongressDahan @SumanSh58123278 @Reema_bjp @_blackdiamond00 @Bhartiysannari @VidudalaPrasad @Rishi_IHA @SK77872309 @faustocloud I❤my nation,Thu Jan 03 16:54:36 +0000 2019,4076,2150,290,False,1,,New Delhi / USA,2,23,0,0
1080865107440267269,@cpraghav Lotus will keep blooming for @narendramodi @BJP4India no matter what 🌸 Slaps will keep coming for @INCIndia @RahulGandhi no matter what ✋,Thu Jan 03 16:34:57 +0000 2019,12796,22740,928,False,10,, India-Canada,11,5,0,0
1080829102590808070,@sherryontopp @INCIndia @IYC Top-of-the-World..? Probably @RahulGandhi has promised deputy CM post of to you..!🤔😂,Thu Jan 03 14:11:53 +0000 2019,29419,644,1668,False,0,,Gujarat India,13,4,0,0
1080770340417163265,RT @Aryanwarlord: Shape of things to come should the @BJP4India lose . The is vindictive &amp; vicious in a way …,Thu Jan 03 10:18:23 +0000 2019,81293,58206,508,False,3,"Shape of things to come should the @BJP4India lose . The is vindictive &amp; vicious in a way can never be, they will destroy all non INC icons of in a bid to usurp power &amp; destroy the true history of this nation.",Unknown,3,2,0,0
1080746086413856768,"Shape of things to come should the @BJP4India lose . The is vindictive &amp; vicious in a way can never be, they will destroy all non INC icons of in a bid to usurp power &amp; destroy the true history of this nation.",Thu Jan 03 08:42:00 +0000 2019,38427,51702,2313,False,3,,New Delhi India,6,1,0,1
1080718594906968064,"@bhootnath @iMac_too @c_aashish @Cawnporiah_ @alok_bhatt We are with U, carry on noble fight Please prevent voters of ,specially &amp; from getting intimated by lies of , instead persuade them to make right choice &amp; help @narendramodi ji in building 👍",Thu Jan 03 06:52:46 +0000 2019,4722,671,44,False,1,,Agartala India,9,6,0,0
1080490222654275589,"@BJP4India @PiyushGoyal @arunjaitley Flying paper planes in lok sabha, thats the real congress. Great but we support bjp and will do it forever",Wed Jan 02 15:45:18 +0000 2019,1652,490,16,False,0,,Unknown,3,3,0,0
1080448518941069312,The speed with which BJP Govt. developed the infrastructure and commissioned the welfare schemes is the main worry of anti politicians. Congress is determined in IT'S malicious campaign against BJP to confuse people to prevent the to form govt. at any cost.,Wed Jan 02 12:59:35 +0000 2019,1141,1015,56,False,0,,Ajmer India,2,0,0,0
1080350406839099392,"RT @hetdesaibjp: Congress lost their ethics ,@inc is no more a political party as they are not ashamed of their actions. @gauravbh @narendr…",Wed Jan 02 06:29:43 +0000 2019,5475,144,50,False,1,"Congress lost their ethics ,@inc is no more a political party as they are not ashamed of their actions. @gauravbh @narendramodi",Navsari India,0,3,0,0
1080305745420345344,se phle hi @INCIndia ye bta Rahi hai ...why shouldn't we Vote for Congressis. The voters who were disappointed after delay in from BJP will surely understand the value of their vote. Kabhi kabhi kuch achche ke liye hota hai..,Wed Jan 02 03:32:15 +0000 2019,656,2424,288,False,0,,Meerut India,3,1,0,1
1080291002055778306,"RT @MockingSkills: If you want performance &amp; good governance, vote for BJP bcs Congress means dynasty, scam &amp; suppression of Hindus. …",Wed Jan 02 02:33:40 +0000 2019,829,6839,32,False,6,"If you want performance &amp; good governance, vote for BJP bcs Congress means dynasty, scam &amp; suppression of Hindus.",Under The Sea,0,1,0,0
1080147073448607744,"@575a2890e746413 In 2019, nothing has changed. Congress is still liers party. They will remain same on 2024. Modi has implimented so much on ground that, by 2024, you will not be required to even go to any govt office to get your job done. Everything is online. No bribe.",Tue Jan 01 17:01:45 +0000 2019,384,254,4,False,0,,India,2,1,0,0
1080145367663038464,Then blame SC or judiciary system and not congress lawers. Cause it makes congress lawyers are more intelligent and Modi BJP helpless infront of them and saying we can not build Ram Mandir till congress lawyers are influencing the process. By the way I support,Tue Jan 01 16:54:58 +0000 2019,177,6810,205,False,0,,Unknown,1,0,0,1
1080077832309669888,RT @BhavyanshP1: Who Will Win 2019 Elections In India ? ाओ_देश_बचाओ …,Tue Jan 01 12:26:36 +0000 2019,166,108,7,False,1,Who Will Win 2019 Elections In India ? ाओ_देश_बचाओ @BJP4India @narendramodi @RahulGandhi @INCIndia,Earth,6,1,0,0
1080077784838483969,Who Will Win 2019 Elections In India ? ाओ_देश_बचाओ @BJP4India @narendramodi @RahulGandhi @INCIndia,Tue Jan 01 12:26:25 +0000 2019,166,108,7,False,1,,Earth,12,4,0,0
1080032326652878849,"RT @hetdesaibjp: @gauravbh @narendramodi Congress lost their ethics ,@inc is no more a political party as they are not ashamed of their act…",Tue Jan 01 09:25:47 +0000 2019,18408,18342,192,False,1,"@gauravbh @narendramodi Congress lost their ethics ,@inc is no more a political party as they are not ashamed of their actions. @gauravbh @narendramodi",DELHIINDIA,0,4,0,0
1079987436162347008,"If you want performance &amp; good governance, vote for BJP bcs Congress means dynasty, scam &amp; suppression of Hindus.",Tue Jan 01 06:27:24 +0000 2019,16083,32810,1368,False,6,,Unknown,2,0,0,0
1083137985338662912,If @narendramodi is continuing the same pace.. &amp; what we just witnessed in last3 days is a trailer.. thn believe me it can break congress’ highest ever tally record in Independent India!! @BJP4India ..,Wed Jan 09 23:06:34 +0000 2019,2900,20139,493,False,1,,Some where as Global Citizen,1,2,0,0
1082975295584567296,"The SP-BSP solidarity has the potential to restrict a division of the opposition votes for , something which had given BJP an edge in 2014 polls, @Ms_Aflatoon.",Wed Jan 09 12:20:05 +0000 2019,100,33800,19571,False,1,,Asia,8,1,0,1
1081026423685558273,@sagarikaghose @BJP4India 44 like in 2014 for Congress looks IMPOSSIBLE to me,Fri Jan 04 03:15:58 +0000 2019,6452,15917,358,False,0,,बैंगलुरु भारत,1,2,0,0
1080850664689938432,Two men fighting for one nation. Who do you think can lead the next term?,Thu Jan 03 15:37:34 +0000 2019,77,1100,303,False,0,,Lucknow India,14,0,0,1
1080125003432001537,Who will u vote for in ? @ZeeNews @abpnewstv @aajtak @RajatSharmaLive,Tue Jan 01 15:34:03 +0000 2019,3022,1615,220,False,0,,India🇮🇳,18,4,0,0
