id_str,full_text,created_at,favourites_count,statuses_count,followers_count,retweeted,retweet_count,retweeted_text,location,hashtags,user_mentions,symbols,urls
1080660062387855360,RT @Marathi_Rash: Now SS is challenging AS.. Late night TF,Thu Jan 03 03:00:11 +0000 2019,9410,884,78,False,1,Now SS is challenging AS.. Late night TF,Unknown,1,1,0,1
1080534319330820096,Now SS is challenging AS.. Late night TF,Wed Jan 02 18:40:31 +0000 2019,7635,40186,23991,False,1,,Mumbai,1,0,0,1
1080660062387855360,RT @Marathi_Rash: Now SS is challenging AS.. Late night TF,Thu Jan 03 03:00:11 +0000 2019,9410,884,78,False,1,Now SS is challenging AS.. Late night TF,Unknown,1,1,0,1
1080534319330820096,Now SS is challenging AS.. Late night TF,Wed Jan 02 18:40:31 +0000 2019,7635,40186,23991,False,1,,Mumbai,1,0,0,1
1083139544793468929,"RT @daily_pol1: Between these two parties, which party do you think is the most corrupt? …",Wed Jan 09 23:12:45 +0000 2019,30023,1797,2440,False,2,"Between these two parties, which party do you think is the most corrupt?",India,4,1,0,0
1083050135683252224,TMC says party MP who joined BJP already 'expelled' @AITCofficial @BJP4India @BJPBengal,Wed Jan 09 17:17:29 +0000 2019,2012,155578,2510,False,0,,Hyderabad,4,3,0,1
1083041604762566659,"RT @BengalNewz: Congress MP from , joined @BJP4India on Wednesday. ""There are many from …",Wed Jan 09 16:43:35 +0000 2019,9482,17352,2104,False,1,"Congress MP from , joined @BJP4India on Wednesday. ""There are many from who want to join "", he said. Earlier in November 2017, , who was once number two in had joined @BJP4Bengal. | RT@WestBengal_BN",Kolkata and New Delhi,4,2,0,0
1083022003056062464,Row: Leaders Tender Resignation As State Ministers to CM,Wed Jan 09 15:25:41 +0000 2019,45,37966,22054,False,0,,Mumbai India,10,0,0,1
1082976345309749249,"Chief Meets And , &amp; Chiefs in to Discuss Financial Crisis",Wed Jan 09 12:24:16 +0000 2019,45,37966,22054,False,0,,Mumbai India,10,0,0,1
1082970016771760129,"Congress MP from , joined @BJP4India on Wednesday. ""There are many from who want to join "", he said. Earlier in November 2017, , who was once number two in had joined @BJP4Bengal. | RT@WestBengal_BN",Wed Jan 09 11:59:07 +0000 2019,13283,47482,4675,False,1,,Kolkata🇮🇳 and Dhaka🇧🇩,8,3,0,0
1082964577904582657,Congress Kisan Ke Saath Dhoka Kar Rahi Hai. Kisan should realise why even after 60 years of Congress Raj there is poor state of Farming in India. @BJP4India,Wed Jan 09 11:37:30 +0000 2019,3326,3975,119,False,0,,Unknown,4,1,0,0
1082959588373057536,"In a setback to ahead of the polls, (TMC) on Wednesday joined the (BJP).",Wed Jan 09 11:17:40 +0000 2019,155,38198,1964,False,0,,Bhubaneshwar India,7,0,0,1
1082955145359515649,"joins | India News, The Indian Express @MamataOfficial @AITCofficial @derekobrienmp",Wed Jan 09 11:00:01 +0000 2019,76597,39844,4065,False,0,,Hyderabad India,5,3,0,0
1082915141849497600,E-Paper For a detailed Version. Please log on to िला ुनावआयोग ाजस्थान ्पर्क ुर,Wed Jan 09 08:21:04 +0000 2019,3,418,18,False,0,,India,21,0,0,1
1082895022343798785,The way @INCIndia debated on yesterday in is shameful. It's time for today to face the challenge in &amp; stop it else along with @BJP4India which is playing...,Wed Jan 09 07:01:07 +0000 2019,4763,12136,1042,False,0,,Mumbai India,4,2,0,1
1082893878846414848,The way @INCIndia debated on yesterday in is shameful. It's time for today to face the challenge in &amp; stop it else along with @BJP4India which is playing vote bank card on communal line Congress will also face heat.,Wed Jan 09 06:56:34 +0000 2019,4763,12136,1042,False,0,,Mumbai India,4,2,0,0
1082891382967001088,@ANI Yesterday @INCIndia Congress Surrendered in coz numbers were not in their favour. But here in they will delay it so that it gets stuck. Showing True Colors. I wonder how they will portray in front of people. BJP Played Win Win Game infront of Upper caste,Wed Jan 09 06:46:39 +0000 2019,218,7570,111,False,1,,India,2,2,0,0
1082749640200601600,"Between these two parties, which party do you think is the most corrupt?",Tue Jan 08 21:23:25 +0000 2019,30027,1797,2440,False,2,,India,16,0,0,0
1082722004258697216,RT @manishBJPUP: Modi govt has been passed in When we mean “Women Empowerment” we prove it. &amp; for Congress who…,Tue Jan 08 19:33:36 +0000 2019,1019,966,32,False,30,Modi govt has been passed in When we mean “Women Empowerment” we prove it. &amp; for Congress who opposed the bill please note that 20 Islamic country has banned &amp; India being “Secular” country should protect the interest of every individual.,लखनऊ भारत,2,1,0,0
1082705370181718016,"Upper Cast 10% Quota Bill Passed in ; PM , And React",Tue Jan 08 18:27:30 +0000 2019,45,37967,22054,False,0,,Mumbai India,9,0,0,1
1082702375133925377,"124th amendment in the constitution, it's no more Ambedkar's constitution. The constitution has become a mere tool for BJP and Congress to play politics. are being cheated and they need to speak up.",Tue Jan 08 18:15:36 +0000 2019,22,36,17,False,38,,New Delhi India,3,0,0,0
1082682644910034946,": for upper gets approval of ; Narendra , President Gandhi, leader Lal Krishna were present in the during the .",Tue Jan 08 16:57:12 +0000 2019,72,175,0,False,1,,Unknown,12,0,0,1
1082682308878987269,"When you have 62.5% reservation, don't call it a reservation please ाओ_देश_बचाओ",Tue Jan 08 16:55:52 +0000 2019,95,113,19,False,3,,Bengaluru India,15,0,0,0
1082675086392520705,Quota bill in haste after poll losses: Congress @KV_Thomas @INCIndia @BJP4India,Tue Jan 08 16:27:10 +0000 2019,2012,155578,2510,False,0,,Hyderabad,4,3,0,1
1082623799898591233,"Lok Sabha today passed the contentious Citizenship (Amendment) Bill 2019, that seeks to to provide Indian citizenship to non-Muslims from Bangladesh, Pakistan and Afghanistan. Read more at:",Tue Jan 08 13:03:22 +0000 2019,1777,2262,5892,False,1,,Dimapur,6,0,0,1
1082564408549621761,E-Paper For a detailed Version. Please log on to िला ुनावआयोग ाजस्थान ्पर्क ुर,Tue Jan 08 09:07:22 +0000 2019,3,418,18,False,0,,India,21,0,0,1
1082516339531476992,"When you choose NOTA in election you directly help Congress, Mayawati, Akhilesh, Lalu, AAP because Muslims rarely choose NOTA and thus BJP loose directly. It is to be observed and to inform all Hindus",Tue Jan 08 05:56:22 +0000 2019,776,1205,218,False,0,,Indirapuram Ghaziabad,5,0,0,0
1082497548344950784,@RahulGandhi Hello today Not Oky 🍭🤣😜🙏🍭🙏,Tue Jan 08 04:41:42 +0000 2019,6762,8121,1461,False,0,,India,9,1,0,0
1082482673862377472,Hello Today Passed?? All present in @INCGujarat @BJP4Gujarat @BJP4India @INCIndia @nitin_gadkari @RahulGandhi @AmitShah 👇💪🙏👇,Tue Jan 08 03:42:35 +0000 2019,6762,8121,1461,False,0,,India,12,7,0,0
1082432877134925824,▪ The Accidental Prime Minister ▪ Narendra Modi's Biopic ▪ Interview given to ANI ▪ Reservation for EB Upper Caste ❇❇ It is all about the timing.,Tue Jan 08 00:24:43 +0000 2019,927,1430,95,False,0,,City Of Joy Kolkata,10,0,0,0
1082275105076473857,Mamata Banerjee As PM Is Not An Isolated Comment By BJP: Somen Mitra,Mon Jan 07 13:57:47 +0000 2019,129,268229,5247,False,0,,Kolkata West Bengal,4,0,0,1
1082234413503590401,Nirmala Sitharaman responds on HAL contracts,Mon Jan 07 11:16:05 +0000 2019,3454,1504,40,False,0,,Unknown,14,0,0,1
1082222883143856129,": Parliament looks set for yet another stormy session on Monday, with the (BJP) and having issued three-line whips for party parliamentarians to be present in the today.",Mon Jan 07 10:30:16 +0000 2019,203,13762,1194,False,0,,United States,4,0,0,1
1082181309647196161,": Parliament looks set for yet another stormy session on Monday, with the (BJP) and having issued three-line whips for party parliamentarians to be present in the today.",Mon Jan 07 07:45:04 +0000 2019,697,13808,1814,False,0,,Unknown,4,0,0,1
1082150912091553792,E-Paper For a detailed Version. Please log on to िला ुनावआयोग ाजस्थान ्पर्क ुर,Mon Jan 07 05:44:17 +0000 2019,3,418,18,False,0,,India,21,0,0,1
1082145745501732864,"RT @GoNews24x7: Chamber Of Chaos | Amid a dogfight in over between &amp; , &amp; MPs continued to pr…",Mon Jan 07 05:23:45 +0000 2019,10465,10687,18,False,5,"Chamber Of Chaos | Amid a dogfight in over between &amp; , &amp; MPs continued to protest against suspension by Speaker. @iankushchoubey reports. For More:",Unknown,6,1,0,0
1082139806371663873,- Parliament pandemonium : The 16th Lok Sabha will be dissolved in a couple of months.,Mon Jan 07 05:00:09 +0000 2019,6,44754,16565,False,0,,Unknown,5,0,0,2
1082139013090328577,In Congress's Mallikarjun Khadge has given notice under rule 193 on demanding a joint parliamentary committee (). @MallikarjunINC @INCIndia @RahulGandhi @BJP4India @PMOIndia,Mon Jan 07 04:57:00 +0000 2019,1911,1760,6366,False,0,,New Delhi India,5,5,0,0
1081968409443631104,: and have simultaneously mandated its respective MPs to be present in tomorrow.,Sun Jan 06 17:39:05 +0000 2019,50,48686,7502,False,0,,BENGALURU,4,0,0,0
1081921737489633282,"Expect showdown in Parliament tomorrow as Rahul Gandhi, Nirmala Sitharaman exchange Twitter barbs over Hindustan Aeronautics Limited(HAL) order , Indian National Congress Bharatiya Janata Party (BJP) ,",Sun Jan 06 14:33:38 +0000 2019,7,166549,2189,False,0,,India,4,0,0,1
1081907932923654144,Hits Back at ; Demands Apology From President For 'Misleading The Nation' on,Sun Jan 06 13:38:46 +0000 2019,45,37967,22054,False,0,,Mumbai India,7,0,0,1
1081898890729709568,"Expect showdown in tomorrow as , exchange Twitter barbs over order",Sun Jan 06 13:02:50 +0000 2019,7,166549,2189,False,0,,India,10,0,0,1
1081890497851871232,Smriti flays Rahul for his ‘winks’ in Lok Sabha during Rafale debate,Sun Jan 06 12:29:29 +0000 2019,59,48214,703,False,0,,Unknown,14,0,0,1
1081830769855614976,President Barrister @asadowaisi On In () Why after 68 yrs of independence Muslims cannot buy or lease house in metropolitan city? Why is it if oppose bjp called Anti National if oppose congress called Anti secular @AimimFansClub @warispathan,Sun Jan 06 08:32:09 +0000 2019,17182,14535,6203,False,27,,Hyderabad TG India ,4,3,0,0
1081800947280490497,E-Paper For a detailed Version. Please log on to िला ुनावआयोग ाजस्थान ्पर्क ुर,Sun Jan 06 06:33:39 +0000 2019,3,418,18,False,0,,India,21,0,0,1
1081643853927538688,@RahulGandhi BJP party is asking questions from many years but didn't even answer one. BJP will make India developed and if Congress will come then India's condition will be like Congo. Congress is a shame for India and BJP proud.,Sat Jan 05 20:09:25 +0000 2019,43,34,1,False,0,,Indore India,5,1,0,0
1081572440868761600,All the best @prakashraaj sir for your political debut. central seat is held by @PCMohanMP since 2008 but holds 5 out of the 8 seats falling under this constituency so it will be advantage if @INCIndia and backs him,Sat Jan 05 15:25:39 +0000 2019,2544,1032,105,False,2,,Chennai India,7,3,0,1
1081568549733392384,"Weekend special: ""Writing a book is an easy task but..."": Sumitra Mahajan ... &amp; more @",Sat Jan 05 15:10:11 +0000 2019,72,175,0,False,1,,Unknown,12,0,0,1
1081548032942866433,@RahulGandhi @narendramodi @BJP4India @INCIndia again in . ​:,Sat Jan 05 13:48:39 +0000 2019,354,139073,1595,False,0,,India,12,4,0,1
1081510111749713920,RT @Iamshuklavikas: Congress desperately embroiled BJP in Rafale. And RaGa has taken gaurd just to confuse BJP with his twist and turn fact…,Sat Jan 05 11:17:58 +0000 2019,289,141,5,False,1,"Congress desperately embroiled BJP in Rafale. And RaGa has taken gaurd just to confuse BJP with his twist and turn facts. Although BJP is confused at this moment whether to defend or attack. Parliament having massive uproar ,major bill are at stake.",Unknown,0,1,0,0
1081465591456849925,"@BJP4India A house with Living room, Kitchen, Toilets, Stairs and a Terrace that makes its called घर Second one is a concrete 4 wall by Congress its called झोपड़ी",Sat Jan 05 08:21:04 +0000 2019,856,624,11,False,1,,Gurugram,3,1,0,0
1081464622001999872,E-Paper For a detailed Version. Please log on to िला ुनावआयोग ाजस्थान ्पर्क ुर,Sat Jan 05 08:17:13 +0000 2019,3,418,18,False,0,,India,21,0,0,1
1081459061579640832,"It was a powerful speech given by In , , but it really looks like saheb is saas &amp; is bahu of the house, and a full fledge drama of blame game is going on 😂 @sardesairajdeep @prakashraaj @ndtv",Sat Jan 05 07:55:07 +0000 2019,2582,644,33,False,0,,Uttarakhand India,8,3,0,0
1081453864996360192,"If Congress comes to power at the center in 2019, will they ban RSS .",Sat Jan 05 07:34:28 +0000 2019,2604,1171,20,False,0,,Unknown,9,0,0,0
1081450106744823810,"Utterly Shameful ! - If this be the respect for and it's institutions of .. then ""God Save India"". -- ‘winks’ again in , faces BJP ire ...",Sat Jan 05 07:19:32 +0000 2019,23951,140781,8363,False,0,,Unknown,4,0,0,1
1081258002731036672,BJP MP Anurag Thakur calls Rahul “a confused &amp; corrupt” leader,Fri Jan 04 18:36:11 +0000 2019,59,48215,703,False,0,,Unknown,13,0,0,1
1081219458134241280,"Congress desperately embroiled BJP in Rafale. And RaGa has taken gaurd just to confuse BJP with his twist and turn facts. Although BJP is confused at this moment whether to defend or attack. Parliament having massive uproar ,major bill are at stake.",Fri Jan 04 16:03:01 +0000 2019,11608,348,62,False,1,,Unknown,3,0,0,0
1081210853490417665,On - Whoever want to do Alliance they will do.. The slogan of “Akele Chalo” will remain the same.,Fri Jan 04 15:28:50 +0000 2019,934,134161,49398,False,0,,INDIA,7,0,0,0
1081160916555550720,"Chamber Of Chaos | Amid a dogfight in over between &amp; , &amp; MPs continued to protest against suspension by Speaker. @iankushchoubey reports. For More:",Fri Jan 04 12:10:24 +0000 2019,1822,18238,5903,False,5,,National Capital Region,7,1,0,1
1081156575795007490,Rafale Debate: Nirmala Sitharaman takes jibe at Congress @nsitharaman @DefenceMinIndia @BJP4India @BJP4Delhi @narendramodi @INCIndia @RahulGandhi @rajnathsingh @AamAadmiParty,Fri Jan 04 11:53:09 +0000 2019,2012,155579,2510,False,0,,Hyderabad,4,9,0,1
1081152826313752576,RT @drrishibjpwb: Congress is shedding crocodile tears for HAL. Congress govt gave 53 waivers to HAL. We have given contracts worth Rs 1…,Fri Jan 04 11:38:15 +0000 2019,15756,21345,565,False,1,Congress is shedding crocodile tears for HAL. Congress govt gave 53 waivers to HAL. We have given contracts worth Rs 1 lakh crore: Defense Minister Smt @nsitharaman,West Bengal India,0,1,0,0
1081148858569318401,Rafale Debate: Nirmala Sitharaman takes jibe at Congress @S_MahajanLS @nsitharaman @DefenceMinIndia @BJP4India @INCIndia @narendramodi,Fri Jan 04 11:22:29 +0000 2019,2012,155579,2510,False,0,,Hyderabad,4,6,0,1
1081132596824887296,"Nirmala Sitharaman Slams Rahul Gandhi in Lok Sabha Over Rafale Deal, Says ‘Congress is Shedding Crocodile Tears For HAL’ @nsitharaman @RahulGandhi @INCIndia @BJP4India",Fri Jan 04 10:17:52 +0000 2019,45,37967,22054,False,0,,Mumbai India,6,4,0,1
1081118165696884736,Defense Minister addresses the on . Watch live @,Fri Jan 04 09:20:31 +0000 2019,1,1589,240,False,0,,Hyderabad India,7,0,0,1
1081118048612798464,"The dust between and remained unsettled even today, as the continued to discuss the .",Fri Jan 04 09:20:03 +0000 2019,334,514399,1987835,False,0,,Mumbai India,4,0,0,1
1081117834430820352,"Nirmala Sitharaman Tears Into Congress in Lok Sabha Over Rafale Deal, Says 'UPA Didn't Intend to Buy Aircraft, NDA Negotiated in 14 Months' @BJP4India @INCIndia @RahulGandhi @nsitharaman",Fri Jan 04 09:19:12 +0000 2019,45,37967,22054,False,1,,Mumbai India,3,4,0,1
1081112037311148035,RM in discussion says Congress-I does defence 'deals' and the BJP deals with defence needs on a priority. Fact!,Fri Jan 04 08:56:10 +0000 2019,10310,46945,1189,False,0,,Unknown,2,0,0,0
1081103752403140608,"BJP MP Sri. Nishikant Dubey is making a brilliant intervention in the - discussion. Calling out the bluff, the long list of inconsistencies in the Congress-I argument.",Fri Jan 04 08:23:15 +0000 2019,10310,46945,1189,False,0,,Unknown,2,0,0,0
1080827264038666242,@narendramodi Vote for @BJP4Gujarat @INCGujarat 👇👍✌️✌️💪🙏,Thu Jan 03 14:04:35 +0000 2019,6762,8121,1461,False,0,,India,8,3,0,1
1080803921709301760,"3 months for ,every where fights over religious sentiments began . This country will never change in term of dirty By the way 9 years old raped and murdered in @sardesairajdeep",Thu Jan 03 12:31:49 +0000 2019,3045,244,1128,False,0,,Hyderabad India,10,1,0,0
1080775174939496449,Do You Need Modi Once More ? @BJP4India @BJP4Karnataka @INCIndia @INCKarnataka @janathadals,Thu Jan 03 10:37:36 +0000 2019,9,5772,153,False,0,,Bengaluru India,7,5,0,0
1080764629674934273,"RT @abpnewstv: : After Congress, Shiv Sena pounces on BJP over JPC for Rafale",Thu Jan 03 09:55:42 +0000 2019,49,7888,81,False,20,": After Congress, Shiv Sena pounces on BJP over JPC for Rafale",jhansi (up),2,1,0,1
1080756187753336833,"""The understanding between Congress &amp; BJP is the reason for our MPs suspension"", Dy Speaker Thambidurai. ""It's a match fixing"", he added @News18TamilNadu",Thu Jan 03 09:22:09 +0000 2019,9631,4578,1589,False,0,,New Delhi,1,1,0,0
1080745597806604289,E-Paper For a detailed Version. Please log on to िला ुनावआयोग ाजस्थान ्पर्क ुर,Thu Jan 03 08:40:04 +0000 2019,3,418,18,False,0,,India,21,0,0,1
1080693801751072768,Speaker scolded the MPs for “childish behaviour”,Thu Jan 03 05:14:15 +0000 2019,106,283608,496202,False,0,,New Delhi India,7,0,0,1
1080632254110396417,unsure about of 2019 Sabha ?,Thu Jan 03 01:09:41 +0000 2019,3076,14128,5090,False,0,,Muzaffarpur Bihar,10,0,0,1
1080549978328584192,"Govt open to suggestions on triple talaq bill, says Prasad",Wed Jan 02 19:42:45 +0000 2019,59,48215,703,False,0,,Unknown,11,0,0,1
1080521288383254528,"Rahul gandhi - in all these media and bjp and congress twitter drama, the common man will have the last laugh as usual in 4 months. Knock it off and go to sleep.",Wed Jan 02 17:48:44 +0000 2019,7,45,1,False,0,,Unknown,3,0,0,0
1080460224199159808,@arunjaitley was at his brilliant best in debate today. Nobody has ability to debate &amp; defeat opposition in argument like him. He destroyed the antics &amp; political stunts of @RahulGandhi.🙌 @BJP4India,Wed Jan 02 13:46:06 +0000 2019,29419,644,1668,False,5,,Gujarat India,8,3,0,0
1080454113727602688,Today is like general candidate who needs 272 seats in and 123 in to win and is like a /ST only 30 seats required to take India back to Mugal era.,Wed Jan 02 13:21:49 +0000 2019,3139,2606,50,False,0,,Bharat,8,0,0,0
1080440956355297280,"@PMOIndia @narendramodi @BJP4India @AmitShah @INCIndia @narendramodi seems, enjoys being kicked.! | : After Congress, pounces on BJP over JPC ⏬ Thackeray said ""Why should I join hands in name of Hindutva with one facing many Corruption allegations, be it or ⏬",Wed Jan 02 12:29:32 +0000 2019,886,137163,679,False,0,,Gwalior India,4,6,0,1
1080440795478380544,": After Congress, Shiv Sena pounces on BJP over JPC for Rafale",Wed Jan 02 12:28:53 +0000 2019,3030,127413,715,False,0,,Rajasthan,2,0,0,1
1080435607615135744,": After Congress, Shiv Sena pounces on BJP over JPC for Rafale",Wed Jan 02 12:08:17 +0000 2019,3,186306,8039240,False,20,,India,2,0,0,1
1080422169367109632,RT @ioktimes: @INCIndia @BJP4India @RahulGandhi Drama in Lok Sabha as Rahul threatens BJP to Play tap…,Wed Jan 02 11:14:53 +0000 2019,228,311,101,False,1,@INCIndia @BJP4India @RahulGandhi Drama in Lok Sabha as Rahul threatens BJP to Play tape,Kulgam Jammu And Kashmir,4,4,0,0
1080418178721734657,@INCIndia @BJP4India @RahulGandhi Drama in Lok Sabha as Rahul threatens BJP to Play tape,Wed Jan 02 10:59:01 +0000 2019,228,311,101,False,1,,Kulgam Jammu And Kashmir,4,3,0,1
1080414412710789120,"Gurjeet Singh Aujla, MP: We threw the paper planes as the discussion was on , so talk about Rafale, but they were talking about Bofors, and . We want a JPC on this issue. @arunjaitley @INCIndia @BJP4India",Wed Jan 02 10:44:03 +0000 2019,1911,1760,6366,False,0,,New Delhi India,5,3,0,0
1080403878250795008,Arun Jaitley Counters Rahul Gandhi on Rafale Deal in Lok Sabha as Congress MPs Throw Paper Planes at Him @arunjaitley @RahulGandhi @INCIndia @BJP4India @narendramodi,Wed Jan 02 10:02:12 +0000 2019,45,37967,22054,False,1,,Mumbai India,4,5,0,1
1080391183531237376,"Why doesn't take responsibility, for a change though, and authenticate statements being made by him in ? Why is he scared? @INCIndia @RahulGandhi @thevaibhavag @drnigam15 @bhupendrachaube @BJP4India Party",Wed Jan 02 09:11:45 +0000 2019,219,6704,102,False,0,,Mumbai,5,6,0,0
1080390640351887360,Today for on discussion with . All India congress party President Mr. @RahulGandhi speech was very nice. He is raise the question was very innovative? BJP party think about is related ? How do increase in price? @ANI @ndtv,Wed Jan 02 09:09:36 +0000 2019,1912,1961,45,False,0,,Salem Tamil nadu India,4,3,0,0
1080389432971354112,"A debate on the between Congress and is likely to be held in today. Also, the will again be tabled in . Parliament winter session LIVE updates",Wed Jan 02 09:04:48 +0000 2019,697,13808,1814,False,0,,Unknown,8,0,0,1
1080382636000833537,E-Paper For a detailed Version. Please log on to िला ुनावआयोग ाजस्थान ्पर्क ुर,Wed Jan 02 08:37:47 +0000 2019,3,418,18,False,0,,India,21,0,0,1
1080367660779622400,Is the Triple Talaq Bill being politically used for 2019 Lok Sabha elections?,Wed Jan 02 07:38:17 +0000 2019,119,1921,665,False,0,,New Delhi India,5,0,0,0
1080126777819836416,"RT @vishalarorabjp: Huge applous @narendramodi govt 4 passing in with 245 in favour, after Congress walkout &amp; de…",Tue Jan 01 15:41:06 +0000 2019,1,215,2,False,18,"Huge applous @narendramodi govt 4 passing in with 245 in favour, after Congress walkout &amp; demand of proposed legislation be sent to select committee for detailed deliberations. The Bill 2 make the practice of in Muslims a Cognizable Offence",Unknown,2,2,0,0
1080082783010279424,This is called 'TRANSPARENCY' which was lacking in the Congress regime. is walking the talk. @BJP4India deserves another term in .,Tue Jan 01 12:46:17 +0000 2019,1366,2406,275,False,0,,Delhi India,4,1,0,1
1080057341825826816,"Congress Accepts Arun Jaitley's Challenge, Ready For A Debate On Rafale @arunjaitley @MallikarjunINC @rajnathsingh @S_MahajanLS @INCIndia @BJP4India @RahulGandhi @narendramodi",Tue Jan 01 11:05:11 +0000 2019,4447,78464,16889,False,0,,India,6,8,0,1
1080019360305958917,E-Paper For a detailed Version. Please log on to िला ुनावआयोग ाजस्थान ्पर्क ुर,Tue Jan 01 08:34:15 +0000 2019,3,418,18,False,0,,India,24,0,0,1
1082661554007523331,RT @Eenadu_English: Andhra CM meets Rahul Gandhi; discuss plans to take on BJP @…,Tue Jan 08 15:33:24 +0000 2019,36403,48754,222,False,1,Andhra CM meets Rahul Gandhi; discuss plans to take on BJP @AndhraPradeshCM @BJP4Andhra @INC_Andhra @JaiTDP @BJP4India @ncbn,TirupatiAndhra I N D I A,5,1,0,0
1082655271665786882,Andhra CM meets Rahul Gandhi; discuss plans to take on BJP @AndhraPradeshCM @BJP4Andhra @INC_Andhra @JaiTDP @BJP4India @ncbn,Tue Jan 08 15:08:26 +0000 2019,2012,155579,2510,False,1,,Hyderabad,5,6,0,1
1083011512120328194,: President Meets to Discuss Possibility of,Wed Jan 09 14:44:00 +0000 2019,45,37967,22054,False,0,,Mumbai India,9,0,0,1
1082988719789862912,"@CTRavi_BJP @RahulGandhi Can list a lot of achievements after @RahulGandhi took over the mettle as CP of C, but one itch you cannot scratch is- your Chaddi dream of making India Congress Mukth is shattered. Also dont you forget Phulpur, Gorakhpur, KA, MP, RJ, CH. Look forward to",Wed Jan 09 13:13:26 +0000 2019,3919,3207,45,False,0,,Bengaluru India,1,3,0,0
1082977732508741632,": BJD Not Part of ; ‘Will Keep Equal Distance From BJP, Congress,’ Says Naveen Patnaik",Wed Jan 09 12:29:46 +0000 2019,45,37967,22054,False,0,,Mumbai India,6,0,0,1
1082941651033583616,RT @firstpost: BJD supremo and Odisha CM Naveen Patnaik said his party would continue to remain equidistant from both the BJP and Congress.…,Wed Jan 09 10:06:24 +0000 2019,8891,23039,204,False,4,BJD supremo and Odisha CM Naveen Patnaik said his party would continue to remain equidistant from both the BJP and Congress.,Bengaluru India,0,1,0,0
1082920266609508352,BJD supremo and Odisha CM Naveen Patnaik said his party would continue to remain equidistant from both the BJP and Congress.,Wed Jan 09 08:41:25 +0000 2019,334,514399,1987836,False,4,,Mumbai India,1,0,0,1
1082899146175062016,BJD president &amp; Odisha CM Naveen Patnaik: BJD will not be part of the Mahagathabandhan. The party will continue to remain equidistant from both BJP &amp; Congress.,Wed Jan 09 07:17:30 +0000 2019,98,299974,53247,False,0,,India,3,0,0,0
1082896941338394624,"@ANI If @INCIndia don't support today in , it would go to 4 seats in next I think @BJP4India will be happier if @INCIndia don't support as it leads to congress mukth bharat",Wed Jan 09 07:08:44 +0000 2019,65,223,3,False,3,,Unknown,3,4,0,0
1082686821467795462,This will destroy lies of @INCIndia and you @RahulGandhi @narendramodi @BJP4India @BJP4Bengal @AmitShah,Tue Jan 08 17:13:48 +0000 2019,112,5622,391,False,0,,HowrahKolkataIN,5,6,0,1
1082679192829931521,in every will vote what says why can't say he either supports or opposes just stupid Q to kill time from just wasting time,Tue Jan 08 16:43:29 +0000 2019,142,30492,3013,False,0,,San Jose,8,0,0,0
1082665086798389249,May wink and hug but leader shot by,Tue Jan 08 15:47:26 +0000 2019,142,30492,3013,False,0,,San Jose,6,0,0,1
